ActionID,ActionName,ActionType,AdaptationCategory,Hazard,Sector,Subsector,PrimaryPurpose,InterventionType,Description,BehavioralChangeTargeted,CoBenefits,EquityAndInclusionConsiderations,GHGReductionPotential,AdaptionEffectiveness,CostInvestmentNeeded,TimelineForImplementation,Dependencies,KeyPerformanceIndicators,Impacts,Intervention Type,BehaviouralChangeTargeted,AdaptationEffectiveness
ipcc_0008,Supply Chain Management,['mitigation'],,,['transportation'],['on-road'],['ghg_reduction'],,"Improving logistics planning in freight transport through strategies such as route optimisation, load optimisation, and eco-driving to reduce travel distances and enhance efficiency, thereby lowering GHG emissions.",,"{'air_quality': 1, 'water_quality': 0, 'habitat': 0, 'cost_of_living': 1, 'housing': 0, 'mobility': 1, 'stakeholder_engagement': 0}",Promotes equitable access to sustainable logistics solutions for small and medium enterprises while supporting job retention in the logistics sector.,"{'stationary_energy': None, 'transportation': '0-19', 'waste': None, 'ippu': None, 'afolu': None}",,medium,5-10 years,"['Access to advanced logistics tools and software, collaboration between supply chain stakeholders, and integration of eco-driving training']","['Reduced freight distances, increased vehicle carrying capacity, improved fuel efficiency, and reduced operating costs']","['Reduced operating costs, improved corporate image, enhanced transport infrastructure utilisation, and potential air quality improvement']","['programs_and_initiatives', 'infrastructure_investments']",Encourages efficient logistics and eco-friendly driving practices to reduce fuel consumption and operational costs.,
ipcc_0009,E-commerce,['mitigation'],,,['transportation'],['on-road'],['ghg_reduction'],,Encouraging consumer purchasing of goods online to reduce travel by light-duty vehicles for shopping purposes. This trades vehicle kilometers traveled for light-duty vehicles with freight transport through light trucks ('last-mile delivery').,,"{'air_quality': 1, 'water_quality': 0, 'habitat': 0, 'cost_of_living': 1, 'housing': 0, 'mobility': 1, 'stakeholder_engagement': 0}","Promotes accessibility to goods for individuals in underserved or remote areas, while reducing personal transportation costs.","{'stationary_energy': None, 'transportation': '0-19', 'waste': None, 'ippu': None, 'afolu': None}",,medium,5-10 years,"['Expansion of e-commerce platforms, investments in last-mile delivery logistics, and consumer trust in online shopping.']","['Reduction in vehicle kilometers traveled (VMT) for shopping, increase in online shopping adoption rates, and emissions reductions in freight logistics.']","['Improved urban mobility, reduced shopping-related travel emissions, and enhanced convenience for consumers.']","['programs_and_initiatives', 'infrastructure_investments']",Encourages a shift from in-person shopping trips to online purchasing and efficient last-mile delivery systems.,
ipcc_0010,Vehicle Automation,['mitigation'],,,['transportation'],['on-road'],['ghg_reduction'],,"Utilizes advanced technologies to automate driving tasks, improve road safety, optimize driving patterns, reduce congestion, and enhance efficient use of road space. Levels range from driver assistance to full autonomy.",,"{'air_quality': 1, 'water_quality': 0, 'habitat': 0, 'cost_of_living': 0, 'housing': 0, 'mobility': 1, 'stakeholder_engagement': 0}","Provides mobility access to marginalized groups, including the elderly, people with disabilities, and those unable to drive, while promoting safer transport systems.","{'stationary_energy': None, 'transportation': '0-19', 'waste': None, 'ippu': None, 'afolu': None}",,high,>10 years,"['Development and deployment of autonomous vehicle technologies, supportive regulatory frameworks, and public acceptance of automated systems.']","['Reduction in congestion, improved fuel efficiency, decreased transport-related emissions per vehicle kilometer, and increased accessibility for marginalized groups.']","['Enhanced road safety, reduced traffic congestion, increased accessibility for underserved populations, and optimization of transport systems for environmental and societal benefit.']","['programs_and_initiatives', 'infrastructure_investments']","Encourages shifts to safer, more efficient automated driving systems, potentially reducing congestion and travel emissions.",
ipcc_0011,Alternative Fuels for Vehicles,['mitigation'],,,['transportation'],['on-road'],['ghg_reduction'],,"Utilizes low-carbon or zero-carbon fuels, including natural gas, biofuels, ammonia, and synthetic fuels, to replace conventional petrol and diesel in internal combustion engines (ICE). These fuels offer pathways to reduce greenhouse gas emissions and diversify energy sources, though challenges remain in production costs, lifecycle emissions, and infrastructure.",,"{'air_quality': 1, 'water_quality': 0, 'habitat': 0, 'cost_of_living': 0, 'housing': 0, 'mobility': 1, 'stakeholder_engagement': 0}",Provides a pathway to reduce energy dependency and enhance energy equity by enabling access to alternative fuels that support local and regional energy needs.,"{'stationary_energy': None, 'transportation': '80-100', 'waste': None, 'ippu': None, 'afolu': None}",,high,>10 years,"['Development of low-cost and sustainable production technologies, supportive policy measures (e.g., fuel standards, blending mandates), and investment in distribution and storage infrastructure.']","['Reduction in GHG emissions from fuel lifecycle, percentage of vehicle fleet using alternative fuels, and infrastructure deployment metrics.']","['Reduced GHG emissions, improved air quality, energy diversification, and increased resilience in transportation systems.']","['programs_and_initiatives', 'infrastructure_investments', 'regulations_and_laws']",Encourages adoption of low-carbon fuel alternatives and a shift from conventional petrol and diesel to more sustainable fuel sources.,
ipcc_0012,Electric Technologies,['mitigation'],,,['transportation'],['on-road'],['ghg_reduction'],,"Adoption of electric vehicle technologies, including Battery Electric Vehicles (BEVs), Hybrid Electric Vehicles (HEVs), and Plug-in Hybrid Electric Vehicles (PHEVs), to reduce GHG emissions and dependence on fossil fuels. BEVs operate on electricity alone, producing zero emissions; HEVs combine an internal combustion engine with an electric motor; PHEVs allow extended electric-only driving.",,"{'air_quality': 1, 'water_quality': 0, 'habitat': 0, 'cost_of_living': 0, 'housing': 0, 'mobility': 1, 'stakeholder_engagement': 0}","Reduces reliance on fossil fuels, improves air quality, and provides cleaner transport options that can benefit underserved communities.","{'stationary_energy': None, 'transportation': '80-100', 'waste': None, 'ippu': None, 'afolu': None}",,high,5-10 years,"['Dependence on advancements in battery technologies, development of charging infrastructure, policies for subsidies and incentives, and integration with renewable energy sources for electricity generation.']","['Percentage of electric vehicles in the vehicle fleet, reduction in GHG emissions per kilometer traveled, and availability of charging infrastructure.']","['Reduced GHG emissions, improved urban air quality, decreased reliance on fossil fuels, and greater energy security.']","['programs_and_initiatives', 'infrastructure_investments', 'incentives_and_subsidies', 'regulations_and_laws']",Encourages a shift from internal combustion engine vehicles to electric vehicles and adoption of renewable energy for charging.,
ipcc_0013,Fuel Cell Technologies,['mitigation'],,,['transportation'],['on-road'],['ghg_reduction'],,"Use of fuel cell technology to power vehicles by converting hydrogen into electricity through an electrochemical reaction. Produces zero emissions at the point of use and water as a by-product. Hydrogen fuel cells are highly efficient, particularly when hydrogen is produced from renewable sources.",,"{'air_quality': 1, 'water_quality': 0, 'habitat': 0, 'cost_of_living': 0, 'housing': 0, 'mobility': 1, 'stakeholder_engagement': 0}","Reduces emissions in underserved and urban areas, offering cleaner air and sustainable mobility solutions for all communities.","{'stationary_energy': None, 'transportation': '60-79', 'waste': None, 'ippu': None, 'afolu': None}",,high,>10 years,"['Hydrogen production infrastructure, availability of low-carbon hydrogen, cost reductions in fuel cell systems, and durable policies to support adoption.']","['Share of fuel cell vehicles in the vehicle fleet, reduction in GHG emissions per kilometer, deployment of hydrogen refueling stations, cost parity with diesel vehicles.']","['Reduced GHG emissions, improved air quality, energy diversification, and advancement of clean technologies for transportation.']","['programs_and_initiatives', 'infrastructure_investments', 'incentives_and_subsidies', 'regulations_and_laws']","Encourages a shift from internal combustion engine vehicles to hydrogen-powered fuel cell vehicles, promoting cleaner transport options.",
ipcc_0014,Lightweighting of Vehicles,['mitigation'],,,['transportation'],['on-road'],['ghg_reduction'],,"Reducing the overall weight of vehicles by using advanced materials such as high-strength steel, aluminum, carbon fiber, and composites to improve fuel efficiency and reduce greenhouse gas emissions. Lightweighting enhances vehicle performance without compromising safety.",,"{'air_quality': 1, 'water_quality': 0, 'habitat': 0, 'cost_of_living': 0, 'housing': 0, 'mobility': 1, 'stakeholder_engagement': 0}","Promotes sustainable mobility solutions that can reduce fuel costs and emissions, indirectly benefiting underserved communities.","{'stationary_energy': None, 'transportation': '0-19', 'waste': None, 'ippu': None, 'afolu': None}",,high,>10 years,"['Availability and development of advanced lightweight materials, efficient recycling processes, and industry-scale implementation.']","['Reduction in vehicle mass, improvement in fuel efficiency (km/l), lifecycle GHG emissions avoided, and share of lightweighted vehicles in the fleet.']","['Reduced GHG emissions, enhanced fuel efficiency, improved vehicle performance, and contribution to a circular economy through advanced recycling.']","['programs_and_initiatives', 'infrastructure_investments', 'incentives_and_subsidies']",Encourages the adoption of vehicles with enhanced fuel efficiency and reduced lifecycle emissions through material innovation.,
ipcc_0015,Improved Energy Efficiency for Vehicles,['mitigation'],,,['transportation'],"['on-road', 'railways', 'waterborne_navigation', 'aviation']",['ghg_reduction'],,"Optimizing vehicle design, technology, and operations to reduce energy consumption and emissions. This includes advanced aerodynamics, efficient powertrains, low rolling resistance tires, better thermal management systems, turbocharging, direct fuel injection, and cylinder deactivation in internal combustion engines, among others.",,"{'air_quality': 1, 'water_quality': 0, 'habitat': 0, 'cost_of_living': 1, 'housing': 0, 'mobility': 1, 'stakeholder_engagement': 0}","Promotes access to efficient and cost-saving transportation technologies, benefiting diverse communities, including underserved regions with high transport costs.","{'stationary_energy': None, 'transportation': '20-39', 'waste': None, 'ippu': None, 'afolu': None}",,high,5-10 years,"['Development and deployment of advanced vehicle technologies, regulatory frameworks, and consumer acceptance.']","['Improvements in fuel economy (km/l), reduction in GHG emissions per km, share of energy-efficient vehicles in fleets, and fuel cost savings.']","['Reduced GHG emissions, enhanced fuel efficiency, lower operating costs, and improved air quality.']","['regulations_and_laws', 'programs_and_initiatives', 'infrastructure_investments']",Encourages adoption of fuel-efficient technologies and operational practices across vehicle types.,
ipcc_0016,Eco-driving,['mitigation'],,,['transportation'],['on-road'],['ghg_reduction'],,"A set of driving practices aimed at improving fuel efficiency, reducing greenhouse gas emissions, and minimizing wear and tear on vehicles by promoting smooth driving, regular vehicle maintenance, and traffic anticipation.",,"{'air_quality': 1, 'water_quality': 0, 'habitat': 0, 'cost_of_living': 1, 'housing': 0, 'mobility': 1, 'stakeholder_engagement': 1}","Promotes accessibility to fuel-saving techniques for all drivers, reducing operating costs and supporting vulnerable communities dependent on vehicle transport.","{'stationary_energy': None, 'transportation': '0-19', 'waste': None, 'ippu': None, 'afolu': None}",,low,<5 years,"['Driver education, effective training programs, policy support, and incentive mechanisms to encourage adoption of eco-driving practices.']","['Percentage reduction in fuel consumption, GHG emissions per vehicle, number of drivers trained in eco-driving, and adherence to eco-driving practices among trained drivers.']","['Reduced GHG emissions, enhanced fuel efficiency, improved road safety, and lower transport costs.']","['programs_and_initiatives', 'incentives_and_subsidies', 'regulations_and_laws']","Encourages drivers to adopt fuel-efficient driving practices, maintain vehicles properly, and avoid aggressive driving behaviors.",
ipcc_0017,Increased Aircraft Efficiency,['mitigation'],,,['transportation'],['aviation'],['ghg_reduction'],,"Optimization of aircraft technology, including improvements in engine design, aerodynamics, airframe mass reduction, and operational navigation to reduce fuel consumption and emissions.",,"{'air_quality': 1, 'water_quality': 0, 'habitat': 0, 'cost_of_living': 0, 'housing': 0, 'mobility': 1, 'stakeholder_engagement': 0}",Supports global connectivity while reducing environmental impacts; may require equitable distribution of technology and resources for developing regions.,"{'stationary_energy': None, 'transportation': '0-19', 'waste': None, 'ippu': None, 'afolu': None}",,high,>10 years,"['Development and adoption of advanced aircraft technology, global air traffic management optimization, and industry investments in research and development.']","['Percentage reduction in fuel consumption per flight, improvement in navigation efficiency, and adoption rate of advanced aircraft designs.']","['Reduced GHG emissions, enhanced operational efficiency, and strengthened energy security in aviation.']","['infrastructure_investments', 'programs_and_initiatives']","Encourages adoption of fuel-efficient navigation routes, operational practices, and investment in advanced aircraft technology.",
ipcc_0018,Alternative Fuels for Aircraft,['mitigation'],,,['transportation'],['aviation'],['ghg_reduction'],,"Development and deployment of alternative aviation fuels, including bio-based SAFs, synthetic fuels, and liquid hydrogen, to reduce aviation greenhouse gas emissions.",,"{'air_quality': 1, 'water_quality': 0, 'habitat': 0, 'cost_of_living': 0, 'housing': 0, 'mobility': 0, 'stakeholder_engagement': 0}","Focus on balancing aviation demand with sustainable practices, addressing food vs. fuel concerns, and ensuring global access to alternative fuel technologies.","{'stationary_energy': None, 'transportation': '60-79', 'waste': None, 'ippu': None, 'afolu': None}",,high,>10 years,"['Availability of low-carbon energy, advancements in fuel production technologies, cost reductions, policy support, and infrastructure for production and distribution.']","['Adoption rates of SAFs, lifecycle emissions reductions, and advancements in fuel production technologies.']","['Significant reductions in aviation emissions, improved energy security, and progress toward net-zero aviation operations.']","['infrastructure_investments', 'programs_and_initiatives', 'regulations_and_laws']",Encourages adoption of sustainable aviation fuels and development of low-carbon fuel infrastructure.,
ipcc_0019,Modal Shift from Aircraft to Train,['mitigation'],,,['transportation'],['aviation'],['ghg_reduction'],,"Promoting a shift from regional and medium-haul flights to high-speed rail (HSR) as a low-carbon alternative. HSR can serve distances of 400–1000 km effectively, reducing demand for air travel and associated emissions. Infrastructure improvements, supportive policies, and enhanced HSR networks are critical for this transition.",,"{'air_quality': 1, 'water_quality': 0, 'habitat': 0, 'cost_of_living': 0, 'housing': 0, 'mobility': 1, 'stakeholder_engagement': 0}","Provides affordable and accessible regional travel options, particularly benefiting communities with limited access to air travel and reducing transportation inequities.","{'stationary_energy': None, 'transportation': '40-59', 'waste': None, 'ippu': None, 'afolu': None}",,high,5-10 years,"['Requires significant investments in HSR infrastructure, policy support to limit competing air travel options, and integration of rail networks with existing transportation systems.']","['Reduction in domestic and regional air travel demand, increase in HSR ridership, and measurable reductions in transportation sector GHG emissions.']","['Reduces aviation emissions, improves regional connectivity, decreases transportation-related air pollution, and enhances public transportation networks.']","['infrastructure_investments', 'regulations_and_laws', 'incentives_and_subsidies', 'programs_and_initiatives']","Encourages a shift in consumer travel preferences from air travel to high-speed rail, fostering acceptance of HSR as a primary mode for regional trips.",
ipcc_0020,Alternative Fuels for Shipping,['mitigation'],,,['transportation'],['waterborne_navigation'],['ghg_reduction'],,"Transition to alternative fuels in the shipping sector, including hydrogen, ammonia, methanol, synthetic hydrocarbons, advanced biofuels, and electric propulsion. Focus on fuels produced using low-carbon energy sources to reduce lifecycle greenhouse gas emissions and achieve International Maritime Organization (IMO) targets.",,"{'air_quality': 1, 'water_quality': 0, 'habitat': 0, 'cost_of_living': 0, 'housing': 0, 'mobility': 1, 'stakeholder_engagement': 1}","Ensures equitable access to new shipping technologies, reduces reliance on fossil fuels, and promotes sustainable economic practices, considering impacts on global trade and port communities.","{'stationary_energy': None, 'transportation': '40-59', 'waste': None, 'ippu': None, 'afolu': None}",,high,>10 years,"['Availability of low-carbon fuels and energy, infrastructure investments, retrofitting capabilities for existing ships, policy and regulatory support, and advances in fuel storage and safety technologies.']","['Adoption rate of alternative fuels, emissions reductions achieved (tank-to-wake and well-to-wake), and advancements in bunkering and storage infrastructure.']","['Significant reductions in maritime emissions, improved air quality, progress toward global decarbonization goals, and reduced reliance on fossil fuels in the shipping industry.']","['infrastructure_investments', 'programs_and_initiatives', 'regulations_and_laws', 'incentives_and_subsidies']","Encourages adoption of low-carbon fuels, improved operational practices, and infrastructure development for sustainable maritime transport.",
ipcc_0021,Electric Technologies for Shipping,['mitigation'],,,['transportation'],['waterborne_navigation'],['ghg_reduction'],,"Adoption of electric propulsion technologies, including battery-electric and hybrid-electric systems, for short-sea shipping, ferries, and inland waterways to reduce greenhouse gas emissions. Includes advancements in design and engineering, such as optimizing hull shapes and integrating renewable energy sources like wind and solar for propulsion.",,"{'air_quality': 1, 'water_quality': 1, 'habitat': 0, 'cost_of_living': 0, 'housing': 0, 'mobility': 1, 'stakeholder_engagement': 0}","Promotes equitable access to clean transportation technologies, benefiting port communities and reducing pollution near densely populated areas. Ensures affordability and accessibility of new infrastructure for small-scale shipping operators.","{'stationary_energy': None, 'transportation': '20-39', 'waste': None, 'ippu': None, 'afolu': None}",,high,>10 years,"['Availability of low-carbon electricity, advancements in battery technology, infrastructure for charging and maintenance, and supportive regulatory frameworks for the maritime industry.']","['Reduction in lifecycle emissions of vessels, number of electric and hybrid-electric ships in operation, and improvements in port infrastructure to support electric propulsion systems.']","['Significant reduction in maritime sector emissions, improved air quality in coastal and port regions, decreased reliance on fossil fuels, and promotion of innovation in clean transportation technologies.']","['infrastructure_investments', 'programs_and_initiatives', 'regulations_and_laws', 'incentives_and_subsidies']",Encourages adoption of low-emission propulsion systems and increased investment in infrastructure to support electric technologies. Promotes shifts toward sustainable practices in the maritime industry.,
ipcc_0022,Improved Energy Efficiency for Shipping,['mitigation'],,,['transportation'],['waterborne_navigation'],['ghg_reduction'],,"Enhancing energy efficiency in shipping through operational measures, optimized hull designs, advanced propulsion systems, and adoption of low-carbon fuels like hydrogen and ammonia. Includes reducing ship speeds ('slow steaming'), improving port operations, and retrofitting vessels with modern technologies to minimize emissions and fuel consumption.",,"{'air_quality': 1, 'water_quality': 1, 'habitat': 0, 'cost_of_living': 0, 'housing': 0, 'mobility': 1, 'stakeholder_engagement': 0}",Promotes equitable access to low-carbon shipping technologies for smaller operators. Supports vulnerable communities by reducing near-shore pollution and improving local air and water quality.,"{'stationary_energy': None, 'transportation': '20-39', 'waste': None, 'ippu': None, 'afolu': None}",,high,5-10 years,"['Availability of low-carbon fuels, advancements in propulsion and hull design technologies, investments in port infrastructure, and regulatory support for energy efficiency and emissions reductions.']","['Reduction in shipping emissions, adoption rate of energy-efficient technologies and operational measures, number of retrofitted vessels, and efficiency improvements in port operations.']","['Reduction in maritime emissions, improved air and water quality, increased energy security, and enhanced innovation in sustainable shipping technologies.']","['infrastructure_investments', 'programs_and_initiatives', 'regulations_and_laws', 'incentives_and_subsidies']","Encourages adoption of energy-efficient practices, operational changes, and investment in infrastructure to support the transition to low-carbon technologies in shipping. Promotes collaboration among stakeholders to achieve decarbonization goals.",
ipcc_0023,Improved Heat and Energy Recovery,['mitigation'],,,['ippu'],['industrial_processes'],['ghg_reduction'],,"Enhanced energy efficiency in industrial processes by recovering heat and energy from waste streams, improving process coupling, and adopting advanced technologies such as coke dry quenching, black liquor gasification, and top pressure recovery turbines. Includes reducing energy use in comminution, paper drying, and other industrial processes through optimized designs, operational improvements, and material efficiency strategies.",,"{'air_quality': 1, 'water_quality': 0, 'habitat': 0, 'cost_of_living': 0, 'housing': 0, 'mobility': 0, 'stakeholder_engagement': 0}",Supports equitable access to energy-efficient technologies and promotes sustainable practices in developing regions with high industrial emissions. Focuses on reducing resource competition and ensuring fair distribution of technological advancements.,"{'stationary_energy': None, 'transportation': None, 'waste': None, 'ippu': '20-39', 'afolu': None}",,high,5-10 years,"['Availability of advanced technologies, supportive regulatory frameworks, investment in research and development, and alignment with global standards for emissions reduction and energy efficiency.']","['Reduction in industrial GHG emissions, adoption rates of heat and energy recovery technologies, energy intensity improvements in key industries, and recycling rates.']","['Significant reductions in industrial emissions, improved resource efficiency, enhanced energy security, and increased sustainability in manufacturing and construction sectors.']","['infrastructure_investments', 'programs_and_initiatives', 'incentives_and_subsidies', 'regulations_and_laws']","Encourages adoption of energy recovery technologies, waste reduction practices, and material efficiency improvements in industrial processes. Promotes recycling and sustainable resource management.",
