ActionID,ActionName,ActionType,AdaptationCategory,Hazard,Sector,Subsector,PrimaryPurpose,InterventionType,Description,BehavioralChangeTargeted,CoBenefits,EquityAndInclusionConsiderations,GHGReductionPotential,AdaptionEffectiveness,CostInvestmentNeeded,TimelineForImplementation,Dependencies,KeyPerformanceIndicators,Impacts,Intervention Type,BehaviouralChangeTargeted,AdaptationEffectiveness
c40_0001,Building Codes,['mitigation'],,,['stationary_energy'],['all'],['ghg_reduction'],['regulations_and_laws'],"""Building Codes and Standards"" entail the formulation and enforcement of regulations guiding the construction of environmentally responsible buildings. By implementing stringent codes, cities promote energy efficiency, reduce carbon emissions, and enhance resilience to climate change, fostering sustainable urban development.","The targeted behavioral change that the ""Building Codes and Standards"" climate action aims to achieve is the adoption of environmentally responsible construction practices among builders, developers, and homeowners. This includes prioritizing energy-efficient designs, utilizing sustainable materials, and adhering to regulations that reduce carbon emissions in new buildings. By enforcing stringent building codes, the intervention seeks to shift perceptions about the importance of sustainability in construction, ultimately leading to a widespread commitment to building practices that contribute to climate resilience and reduced greenhouse gas emissions.","{'air_quality': 0, 'water_quality': 1, 'habitat': 0, 'cost_of_living': 0, 'housing': -1, 'mobility': 0, 'stakeholder_engagement': 0}","The ""Building Codes and Standards"" climate action promotes equity and inclusion in several ways:

1. **Access to Safe Housing**: By enforcing stringent building codes, the action ensures that all communities, including vulnerable and underserved populations, have access to safe, resilient, and environmentally responsible housing. This helps protect these communities from the adverse effects of climate change.

2. **Energy Efficiency Benefits**: The promotion of energy-efficient buildings can lead to lower utility costs, which disproportionately benefits low-income households that may struggle with energy expenses. This economic relief contributes to greater financial stability for underserved communities.

3. **Health and Safety Improvements**: Enhanced building standards can improve indoor air quality and reduce health risks associated with poor construction practices. Vulnerable populations often face higher health risks, and these improvements can lead to better overall health outcomes.

4. **Community Resilience**: By fostering resilience to climate change through improved building standards, the action helps ensure that underserved communities are better equipped to withstand climate-related events, thereby promoting long-term sustainability and stability.

5. **Inclusive Development**: The formulation of building codes often involves community input, ensuring that the voices of marginalized groups are considered in the decision-making process. This participatory approach fosters a sense of ownership and inclusion among all community members.

Overall, the ""Building Codes and Standards"" action integrates equity and inclusion by prioritizing the needs and well-being of vulnerable communities in the context of sustainable urban development.","{'stationary_energy': '0-19', 'transportation': None, 'waste': None, 'ippu': None, 'afolu': None}",,medium,5-10 years,"['Collaboration with local governments to develop and enforce building codes', 'Access to up-to-date research on sustainable building practices and materials', 'Training and education for builders and contractors on new standards', 'Public awareness campaigns to inform stakeholders about the benefits of energy-efficient buildings', 'Funding and financial incentives for implementing energy-efficient technologies in construction']","['Percentage reduction in energy consumption of new buildings', 'Percentage of buildings compliant with updated building codes', 'Reduction in greenhouse gas emissions from the building sector', 'Number of buildings certified under green building standards', 'Percentage increase in the use of sustainable building materials', 'Average resilience score of buildings against climate-related hazards', 'Number of training sessions conducted for builders and architects on new codes', 'Public awareness and engagement levels regarding building codes and standards']","['Reduction in greenhouse gas emissions from stationary energy', 'Improved energy efficiency in buildings', 'Enhanced access to safe and resilient housing for vulnerable communities', 'Lower utility costs benefiting low-income households', 'Improved indoor air quality and health outcomes', 'Increased community resilience to climate change', 'Inclusive development through community input in building codes']",,,
c40_0002,Building Codes,['mitigation'],,,['stationary_energy'],['residential_buildings'],['ghg_reduction'],['regulations_and_laws'],"""Building Codes and Standards, Residential Buildings"" entail the formulation and enforcement of regulations guiding the construction of environmentally responsible buildings. By implementing stringent codes, cities promote energy efficiency, reduce carbon emissions, and enhance resilience to climate change, fostering sustainable urban development.","The targeted behavioral change that the climate action ""Building Codes and Standards, Residential Buildings"" aims to achieve is the adoption of energy-efficient construction practices among builders, developers, and homeowners. This includes prioritizing the use of sustainable materials, implementing energy-saving technologies, and adhering to regulations that mandate environmentally responsible building designs. By fostering a culture of compliance with stringent building codes, the intervention seeks to reduce carbon emissions associated with residential construction and promote a shift towards more sustainable urban development.","{'air_quality': 0, 'water_quality': 1, 'habitat': 0, 'cost_of_living': 0, 'housing': -1, 'mobility': 0, 'stakeholder_engagement': 0}","The climate action of implementing ""Building Codes and Standards"" for residential buildings promotes equity and inclusion in several ways:

1. **Access to Safe Housing**: By enforcing building codes that prioritize safety and environmental responsibility, vulnerable communities are ensured access to safe and resilient housing, reducing their risk of displacement due to climate-related events.

2. **Energy Efficiency Benefits**: Stricter energy efficiency standards can lower utility costs for residents, particularly benefiting low-income households that may struggle with high energy bills, thus promoting economic equity.

3. **Health Improvements**: Environmentally responsible buildings often incorporate better ventilation and materials that reduce indoor pollutants, leading to improved health outcomes for underserved communities that may be disproportionately affected by poor housing conditions.

4. **Community Resilience**: By enhancing the resilience of residential buildings to climate change impacts, these codes help protect underserved communities from the adverse effects of climate events, fostering a more equitable recovery and adaptation process.

5. **Inclusive Development**: The formulation of these codes often involves community input, ensuring that the voices of vulnerable populations are considered in the decision-making process, thus promoting inclusivity in urban development.

6. **Job Creation**: The implementation of new building standards can create job opportunities in construction and retrofitting, particularly benefiting local workers from underserved communities, thereby supporting economic inclusion. 

Overall, the action of establishing building codes and standards inherently considers the needs and rights of vulnerable and underserved communities, promoting a more equitable and inclusive approach to climate action.","{'stationary_energy': '80-100', 'transportation': None, 'waste': None, 'ippu': None, 'afolu': None}",,medium,5-10 years,"['Collaboration with local governments to develop and enforce building codes', 'Access to updated research and data on energy efficiency and sustainable materials', 'Training and resources for builders and contractors on new standards', 'Public awareness and support for sustainable building practices', 'Integration with existing urban planning and zoning regulations']","['Energy efficiency improvements', 'Reduction in carbon emissions', 'Number of buildings compliant with codes', 'Percentage of new constructions meeting sustainability standards', 'Reduction in energy consumption per square foot', 'Increase in use of renewable energy sources in buildings', 'Cost savings from energy-efficient upgrades', 'Improvement in indoor air quality', 'Resilience metrics against climate-related events', 'Stakeholder engagement and compliance rates']","['Reduction in GHG emissions from residential buildings', 'Improved energy efficiency leading to lower utility costs for residents', 'Enhanced safety and resilience of housing for vulnerable communities', 'Creation of job opportunities in construction and retrofitting', 'Increased community engagement in urban development decisions']",,,
c40_0003,Building Codes,['mitigation'],,,['stationary_energy'],['commercial_and_institutional_buildings_and_facilities'],['ghg_reduction'],['regulations_and_laws'],"""Building Codes and Standards, Commercial Buildings"" entail the formulation and enforcement of regulations guiding the construction of environmentally responsible buildings. By implementing stringent codes, cities promote energy efficiency, reduce carbon emissions, and enhance resilience to climate change, fostering sustainable urban development.","The targeted behavioral shift that the climate action ""Building Codes and Standards, Commercial Buildings"" aims to achieve is the adoption of environmentally responsible construction practices among builders, architects, and developers. This includes prioritizing energy efficiency, utilizing sustainable materials, and adhering to stringent building regulations that reduce carbon emissions and enhance resilience to climate change. By enforcing these codes, the intervention seeks to change perceptions about the importance of sustainable building practices, ultimately leading to a widespread commitment to constructing energy-efficient commercial buildings.","{'air_quality': 0, 'water_quality': 1, 'habitat': 0, 'cost_of_living': 0, 'housing': -1, 'mobility': 0, 'stakeholder_engagement': 0}","The climate action of implementing ""Building Codes and Standards, Commercial Buildings"" promotes equity and inclusion in several ways:

1. **Access to Safe and Healthy Environments**: By enforcing regulations for environmentally responsible buildings, the action ensures that all communities, including vulnerable and underserved populations, have access to safe, healthy, and energy-efficient spaces, reducing exposure to harmful pollutants and improving overall well-being.

2. **Economic Opportunities**: The development and enforcement of building codes can create job opportunities in construction, retrofitting, and maintenance of energy-efficient buildings, particularly benefiting local workers from underserved communities.

3. **Resilience to Climate Change**: By enhancing the resilience of buildings to climate impacts, the action helps protect vulnerable communities that are often disproportionately affected by climate-related disasters, ensuring they have safer living and working conditions.

4. **Energy Cost Savings**: Energy-efficient buildings can lead to lower utility bills, which is particularly beneficial for low-income households and businesses, helping to alleviate financial burdens and promote economic equity.

5. **Community Engagement**: The process of formulating building codes often involves stakeholder engagement, which can include input from underserved communities, ensuring their needs and perspectives are considered in the development of regulations that affect their environments.

6. **Long-term Sustainability**: By promoting sustainable urban development through these codes, the action supports the long-term viability of neighborhoods that may be at risk of displacement or neglect, fostering inclusive growth and stability.","{'stationary_energy': '80-100', 'transportation': None, 'waste': None, 'ippu': None, 'afolu': None}",,medium,5-10 years,"['Collaboration with local governments to develop and enforce building codes', 'Access to updated scientific research on energy efficiency and climate resilience', 'Training and resources for builders and contractors on new standards', 'Public awareness and support for sustainable building practices', 'Funding and incentives for compliance with building codes']","['Energy consumption reduction', 'Carbon emissions reduction', 'Percentage of buildings meeting code standards', 'Cost savings from energy efficiency', 'Number of buildings certified under green building standards', 'Improvement in indoor air quality', 'Resilience score against climate impacts', 'Rate of compliance with building codes', 'Reduction in water usage', 'Increase in renewable energy usage in buildings']","['Reduction in greenhouse gas emissions by 80-100% in stationary energy sector', 'Promotion of energy-efficient construction practices among builders and developers', 'Improvement in water quality through sustainable building practices', 'Creation of job opportunities in construction and maintenance', 'Enhanced resilience of buildings to climate change impacts', 'Lower utility bills for low-income households and businesses', 'Increased access to safe and healthy environments for underserved communities']",,,
c40_0004,Building Codes,['mitigation'],,,['stationary_energy'],['commercial_and_institutional_buildings_and_facilities'],['ghg_reduction'],['regulations_and_laws'],"""Building Codes and Standards, Institutional Buildings"" entail the formulation and enforcement of regulations guiding the construction of environmentally responsible buildings. By implementing stringent codes, cities promote energy efficiency, reduce carbon emissions, and enhance resilience to climate change, fostering sustainable urban development.","The targeted behavioral change that the climate action ""Building Codes and Standards, Institutional Buildings"" aims to achieve is the adoption of energy-efficient construction practices among builders, architects, and developers. This intervention seeks to encourage these stakeholders to prioritize environmentally responsible building designs and materials, thereby reducing carbon emissions and enhancing resilience to climate change. By enforcing regulations and standards, the action promotes a shift towards sustainable urban development, ultimately leading to a broader societal acceptance and implementation of energy-efficient practices in the construction industry.","{'air_quality': 0, 'water_quality': 1, 'habitat': 0, 'cost_of_living': 0, 'housing': -1, 'mobility': 0, 'stakeholder_engagement': 0}","The climate action of implementing Building Codes and Standards for Institutional Buildings promotes equity and inclusion in several ways:

1. **Access to Safe and Healthy Environments**: By enforcing regulations for environmentally responsible buildings, the action ensures that all communities, including vulnerable and underserved populations, have access to safe, healthy, and energy-efficient spaces. This is particularly important for institutions that serve these communities, such as schools and healthcare facilities.

2. **Resilience to Climate Change**: The focus on enhancing resilience through stringent building codes helps protect underserved communities that are often more vulnerable to the impacts of climate change. By ensuring that buildings can withstand climate-related challenges, the action supports the safety and well-being of these populations.

3. **Energy Efficiency and Cost Savings**: Promoting energy-efficient buildings can lead to lower utility costs, which disproportionately benefits low-income households. By reducing energy expenses, the action helps alleviate financial burdens on underserved communities, contributing to economic equity.

4. **Community Engagement in Development**: The formulation of building codes often involves stakeholder engagement, which can include input from marginalized communities. This participatory approach ensures that the needs and concerns of these populations are considered in the development of regulations, fostering a sense of inclusion.

5. **Job Creation and Economic Opportunities**: The implementation of new building standards can create job opportunities in construction and retrofitting, particularly in underserved areas. This can help stimulate local economies and provide employment for community members who may face barriers to job access.

Overall, the action of establishing Building Codes and Standards for Institutional Buildings inherently considers equity and inclusion by prioritizing the needs of vulnerable communities, enhancing their resilience, and promoting access to sustainable and healthy environments.","{'stationary_energy': '80-100', 'transportation': None, 'waste': None, 'ippu': None, 'afolu': None}",,medium,5-10 years,"['Collaboration with local governments to develop and enforce building codes', 'Access to updated research and data on energy efficiency and sustainable materials', 'Training and resources for builders and contractors on new standards', 'Public awareness and support for sustainable building practices', 'Integration with existing urban planning and development policies']","['Energy consumption reduction', 'Carbon emissions reduction', 'Number of buildings compliant with codes', 'Percentage of new buildings meeting sustainability standards', 'Cost savings from energy efficiency improvements', 'Increase in renewable energy usage in buildings', 'Reduction in water usage', 'Improvement in indoor air quality', 'Resilience score against climate impacts', 'Stakeholder engagement and training sessions conducted']","['Reduction of GHG emissions by 80-100% in stationary energy sector', 'Promotion of energy-efficient construction practices', 'Improved access to safe and healthy environments for underserved communities', 'Enhanced resilience of buildings to climate change impacts', 'Lower utility costs benefiting low-income households', 'Job creation and economic opportunities in construction', 'Increased community engagement in development processes']",,,
c40_0005,Building Codes,['mitigation'],,,['stationary_energy'],['manufacturing_industries_and_construction'],['ghg_reduction'],['regulations_and_laws'],"""Building Codes and Standards, Industrial Buildings"" entail the formulation and enforcement of regulations guiding the construction of environmentally responsible buildings. By implementing stringent codes, cities promote energy efficiency, reduce carbon emissions, and enhance resilience to climate change, fostering sustainable urban development.","The targeted behavioral shift that the climate action ""Building Codes and Standards, Industrial Buildings"" aims to achieve is the adoption of energy-efficient construction practices among builders, architects, and developers. This shift encourages stakeholders in the construction industry to prioritize environmentally responsible building designs and materials, leading to reduced carbon emissions and enhanced resilience to climate change. By enforcing stringent regulations, the intervention seeks to change perceptions about the importance of sustainability in construction, ultimately fostering a culture of energy efficiency and sustainable urban development.","{'air_quality': 0, 'water_quality': 1, 'habitat': 0, 'cost_of_living': 0, 'housing': -1, 'mobility': 0, 'stakeholder_engagement': 0}","The climate action of establishing ""Building Codes and Standards, Industrial Buildings"" promotes equity and inclusion in several ways:

1. **Access to Safe and Healthy Environments**: By enforcing regulations for environmentally responsible buildings, the action ensures that all communities, including vulnerable and underserved populations, have access to safe, healthy, and energy-efficient living and working environments.

2. **Economic Opportunities**: The implementation of stringent building codes can create job opportunities in the construction and retrofitting sectors, particularly benefiting low-income individuals and communities that may face barriers to employment.

3. **Resilience to Climate Change**: By enhancing resilience to climate change, the action helps protect underserved communities that are often disproportionately affected by climate impacts, ensuring they are better equipped to withstand environmental challenges.

4. **Reduction of Energy Burden**: Promoting energy efficiency through building standards can lower energy costs for residents and businesses in underserved areas, alleviating the financial strain often experienced by these communities.

5. **Community Engagement**: The formulation of building codes often involves stakeholder engagement, which can include input from vulnerable communities, ensuring their voices and needs are considered in the decision-making process.

6. **Long-term Sustainability**: By fostering sustainable urban development, the action contributes to the overall well-being of all community members, particularly those in marginalized groups who may benefit from improved infrastructure and services. 

Overall, this climate action integrates equity and inclusion by addressing the specific needs and challenges faced by vulnerable and underserved communities while promoting broader environmental and economic benefits.","{'stationary_energy': '80-100', 'transportation': None, 'waste': None, 'ippu': None, 'afolu': None}",,medium,5-10 years,"['Collaboration with local governments to develop and enforce building codes', 'Access to updated research and data on energy efficiency and sustainable materials', 'Training and resources for builders and contractors on new standards', 'Public awareness and support for sustainable building practices', 'Integration with existing urban planning and development policies']","['Energy efficiency improvements', 'Reduction in carbon emissions', 'Number of buildings compliant with codes', 'Percentage of new buildings meeting sustainability standards', 'Reduction in energy consumption per square foot', 'Increase in use of renewable energy sources', 'Cost savings from energy efficiency measures', 'Improvement in indoor air quality', 'Resilience metrics against climate impacts', 'Stakeholder engagement and compliance rates']","['Reduction of GHG emissions by 80-100% in stationary energy sector', 'Promotion of energy-efficient construction practices', 'Improved access to safe and healthy environments for underserved communities', 'Creation of job opportunities in construction and retrofitting sectors', 'Enhanced resilience to climate change for vulnerable populations', 'Lower energy costs alleviating financial strain on underserved communities', 'Inclusion of community input in building code formulation']",,,
