ActionID,ActionName,ActionType,AdaptationCategory,Hazard,Sector,Subsector,PrimaryPurpose,InterventionType,Description,BehavioralChangeTargeted,CoBenefits,EquityAndInclusionConsiderations,GHGReductionPotential,AdaptionEffectiveness,CostInvestmentNeeded,TimelineForImplementation,Dependencies,KeyPerformanceIndicators,Impacts,Intervention Type,BehaviouralChangeTargeted,AdaptationEffectiveness
c40_0025,Truck Emissions,['mitigation'],,,['transportation'],['on-road'],['ghg_reduction'],"['programs_and_initiatives', 'incentives_and_subsidies']","""Truck Emissions"" mitigation involves adopting cleaner fuels and technologies to reduce the environmental impact of freight transportation. This initiative aims to decrease air pollution, promote sustainability, and improve the overall efficiency of urban logistics.","The targeted behavioral change that the ""Truck Emissions"" mitigation initiative aims to achieve is the adoption of cleaner fuels and technologies by freight transportation companies. This shift encourages these companies to prioritize sustainability and efficiency in their logistics operations, ultimately leading to reduced air pollution and greenhouse gas emissions. By implementing financial incentives and supportive programs, the initiative seeks to influence the decision-making of businesses, prompting them to invest in environmentally friendly practices and technologies.","{'air_quality': 1, 'water_quality': 0, 'habitat': 0, 'cost_of_living': 0, 'housing': 0, 'mobility': 0, 'stakeholder_engagement': 0}","The ""Truck Emissions"" mitigation action promotes equity and inclusion by addressing the following aspects:

1. **Health Benefits for Vulnerable Communities**: By reducing air pollution from freight transportation, the initiative directly benefits underserved communities that are often located near major transportation routes and are disproportionately affected by poor air quality. This leads to improved public health outcomes for these populations.

2. **Access to Cleaner Technologies**: The adoption of cleaner fuels and technologies can create opportunities for underserved communities to access modern, efficient transportation solutions. This can help bridge the gap in transportation equity, ensuring that all communities benefit from advancements in technology.

3. **Job Creation and Economic Opportunities**: The transition to cleaner freight technologies may generate new jobs in the green economy, particularly in areas that have historically faced economic challenges. This can provide employment opportunities for individuals in vulnerable communities, fostering economic inclusion.

4. **Community Engagement**: The initiative may involve engaging local communities in the planning and implementation process, ensuring that the voices of those most affected by truck emissions are heard and considered. This participatory approach promotes inclusivity and empowers communities to advocate for their needs.

5. **Sustainability and Resilience**: By promoting sustainable practices in freight transportation, the action contributes to the long-term resilience of vulnerable communities against climate change impacts, ensuring that they are not left behind in the transition to a more sustainable future. 

Overall, the ""Truck Emissions"" mitigation action is designed to enhance equity and inclusion by prioritizing the health, economic opportunities, and voices of underserved communities.","{'stationary_energy': None, 'transportation': '20-39', 'waste': None, 'ippu': None, 'afolu': None}",,medium,<5 years,"['Availability of cleaner fuels and technologies', 'Investment in infrastructure to support cleaner freight options', 'Regulatory frameworks promoting emissions reductions', 'Collaboration between government, industry, and stakeholders', 'Public awareness and acceptance of cleaner transportation methods']","['Reduction in CO2 emissions (tons)', 'Percentage of trucks using cleaner fuels', 'Improvement in fuel efficiency (miles per gallon)', 'Reduction in particulate matter emissions (PM2.5)', 'Increase in the number of electric or hybrid trucks', 'Cost savings from fuel efficiency improvements', 'Percentage decrease in urban air pollution levels', 'Number of logistics companies adopting sustainable practices']","['Reduction in air pollution leading to improved public health, especially for vulnerable communities', 'Encouragement of cleaner fuel and technology adoption among freight transportation companies', 'Creation of job opportunities in the green economy', 'Enhanced equity and inclusion through community engagement and access to cleaner technologies', 'Long-term resilience of underserved communities against climate change impacts', '20-39% GHG reduction potential in the transportation sector']",,,
c40_0026,Vehicle Emissions,['mitigation'],,,['transportation'],['on-road'],['ghg_reduction'],"['programs_and_initiatives', 'incentives_and_subsidies', 'regulations_and_laws']","""Vehicle Emissions"" reduction strategies focus on minimizing the environmental impact of all types of vehicles. Implementing cleaner technologies and promoting alternative fuels contribute to lower emissions, fostering sustainable and eco-friendly transportation.","The targeted behavioral shift that the ""Vehicle Emissions"" reduction strategies aim to achieve is the increased adoption of cleaner transportation options among individuals and groups. This includes encouraging people to choose electric or hybrid vehicles, utilize alternative fuels, and rely more on public transportation, biking, or walking instead of traditional gasoline-powered vehicles. The interventions—such as incentives for purchasing electric vehicles, regulations mandating lower emissions, and programs promoting sustainable transportation—are designed to change perceptions about the safety, convenience, and affordability of these eco-friendly options, ultimately leading to a significant reduction in greenhouse gas emissions from the transportation sector.","{'air_quality': 1, 'water_quality': 0, 'habitat': 0, 'cost_of_living': 0, 'housing': 0, 'mobility': 0, 'stakeholder_engagement': 0}","The ""Vehicle Emissions"" reduction strategies inherently promote equity and inclusion by addressing the environmental impacts that disproportionately affect vulnerable and underserved communities. These communities often experience higher levels of air pollution and related health issues due to proximity to high-traffic areas and industrial zones. By implementing cleaner technologies and promoting alternative fuels, the action directly benefits these populations by improving air quality and reducing health risks.

Additionally, the focus on sustainable and eco-friendly transportation can enhance access to affordable and reliable transportation options for underserved communities, which may lack access to clean and efficient vehicles. This can lead to increased mobility and economic opportunities, fostering greater social equity.

Overall, the action recognizes the need to prioritize the health and well-being of vulnerable populations, ensuring that they are included in the benefits of cleaner transportation solutions.","{'stationary_energy': None, 'transportation': '80-100', 'waste': None, 'ippu': None, 'afolu': None}",,medium,<5 years,"['Development and adoption of cleaner vehicle technologies', 'Availability and accessibility of alternative fuels', 'Government policies and regulations supporting emissions reduction', 'Public awareness and education on sustainable transportation', 'Investment in infrastructure for alternative fuel vehicles', 'Collaboration between automotive manufacturers and environmental organizations']","['Reduction in vehicle emissions (CO2, NOx, PM)', 'Percentage of vehicles using alternative fuels', 'Number of electric vehicles on the road', 'Fuel efficiency improvements (miles per gallon)', 'Adoption rate of cleaner technologies', 'Reduction in fossil fuel consumption', 'Public transportation usage rates', 'Air quality index improvements', 'Percentage of urban areas with low-emission zones', 'Investment in sustainable transportation infrastructure']","['Significant reduction in greenhouse gas emissions from the transportation sector', 'Improvement in air quality, benefiting vulnerable communities', 'Increased adoption of cleaner transportation options', 'Enhanced access to affordable and reliable transportation for underserved populations', 'Promotion of social equity through environmental justice initiatives']",,,
c40_0027,Rail Improvements,['mitigation'],,,['transportation'],['railways'],['ghg_reduction'],"['infrastructure_investments', 'programs_and_initiatives']","""Rail Improvements"" involve enhancing the efficiency and sustainability of railway systems. By investing in modernization and eco-friendly practices, cities aim to promote rail as a low-emission and energy-efficient mode of transportation.","The targeted behavioral change that the ""Rail Improvements"" climate action aims to achieve is an increased reliance on rail transportation as a primary mode of travel, leading to a reduction in the use of personal vehicles. This shift is encouraged by enhancing the efficiency, safety, and convenience of rail systems, thereby changing public perceptions about rail travel and promoting it as a low-emission, energy-efficient alternative. As a result, individuals are more likely to choose rail over higher-emission transportation options, contributing to a significant decrease in greenhouse gas emissions.","{'air_quality': 1, 'water_quality': 0, 'habitat': 0, 'cost_of_living': 0, 'housing': 0, 'mobility': 0, 'stakeholder_engagement': 0}","The ""Rail Improvements"" climate action promotes equity and inclusion by enhancing access to efficient and sustainable transportation options for vulnerable and underserved communities. By modernizing railway systems, the action aims to provide reliable and affordable transit alternatives, which can benefit low-income individuals who may rely on public transportation for their daily commutes. 

Additionally, the focus on eco-friendly practices ensures that these communities are less exposed to pollution and its associated health risks, contributing to overall community well-being. The investment in rail infrastructure can also create job opportunities in these areas, fostering economic development and inclusion. Overall, the initiative addresses the transportation needs of underserved populations while promoting environmental sustainability.","{'stationary_energy': None, 'transportation': '40-59', 'waste': None, 'ippu': None, 'afolu': None}",,high,5-10 years,"['Investment in infrastructure and technology for rail systems', 'Collaboration with government and private sectors for funding and support', 'Public awareness and acceptance of rail as a sustainable transportation option', 'Integration with existing transportation networks for seamless connectivity', 'Regulatory frameworks that promote eco-friendly practices in rail operations']","['Reduction in greenhouse gas emissions from rail transport', 'Increase in rail ridership', 'Percentage of trains using renewable energy sources', 'Improvement in energy efficiency of rail systems', 'Reduction in travel time for rail passengers', 'Increase in freight transported by rail', 'Customer satisfaction ratings for rail services', 'Investment in rail infrastructure improvements', 'Reduction in maintenance costs for rail systems', 'Increase in the number of rail stations with eco-friendly facilities']","['Significant reduction in greenhouse gas emissions from transportation (40-59%)', 'Improved air quality due to decreased reliance on personal vehicles', 'Enhanced access to sustainable transportation for vulnerable communities', 'Creation of job opportunities through infrastructure investments', 'Promotion of equity and inclusion in public transit access']",,,
c40_0028,Zero Emission Buses,['mitigation'],,,['transportation'],['on-road'],['ghg_reduction'],"['programs_and_initiatives', 'infrastructure_investments']","""Zero Emission Buses"" initiatives focus on integrating electric or other zero-emission technologies into public transportation fleets. This strategy aims to eliminate traditional bus emissions, contributing to cleaner air and a more sustainable urban transit system.","The targeted behavioral change that the ""Zero Emission Buses"" initiative aims to achieve is an increased reliance on public transportation, specifically the use of electric or zero-emission buses, over personal vehicles. This shift is intended to encourage individuals to choose cleaner, more sustainable transit options, thereby reducing greenhouse gas emissions and contributing to improved air quality in urban areas. By enhancing the perception of public transportation as a convenient, safe, and environmentally friendly alternative, the initiative seeks to foster a cultural shift towards prioritizing collective transit solutions over individual car usage.","{'air_quality': 2, 'water_quality': 0, 'habitat': 0, 'cost_of_living': 0, 'housing': 0, 'mobility': 0, 'stakeholder_engagement': 0}","The ""Zero Emission Buses"" initiative promotes equity and inclusion by prioritizing cleaner air in urban areas, which often include vulnerable or underserved communities that are disproportionately affected by air pollution. By transitioning to electric or zero-emission buses, the initiative directly addresses health disparities faced by these populations, improving their overall quality of life.

Additionally, the integration of zero-emission technologies in public transportation enhances accessibility to reliable and sustainable transit options for low-income individuals who may rely heavily on public transport. This ensures that all community members, regardless of socioeconomic status, have equitable access to clean and efficient transportation.

Furthermore, the initiative may create job opportunities in the green technology sector, particularly for residents in underserved communities, fostering economic inclusion and empowerment. By considering the needs of these communities in the planning and implementation phases, the initiative actively works to reduce systemic inequalities related to transportation and environmental health.","{'stationary_energy': None, 'transportation': '20-39', 'waste': None, 'ippu': None, 'afolu': None}",,high,<5 years,"['Availability of electric or zero-emission bus technology', 'Investment in charging infrastructure for electric buses', 'Supportive government policies and incentives for zero-emission transportation', 'Public awareness and acceptance of electric buses', 'Collaboration with manufacturers and suppliers for bus procurement', 'Sufficient funding and budget allocation for fleet transition', 'Maintenance and training programs for new technologies']","['Number of zero-emission buses deployed', 'Reduction in greenhouse gas emissions', 'Percentage of public transportation fleet that is zero-emission', 'Air quality improvement metrics', 'Operational cost savings from zero-emission buses', 'Public ridership levels', 'Energy consumption per mile', 'Maintenance costs of zero-emission buses', 'User satisfaction ratings', 'Reduction in noise pollution']","['Reduction of greenhouse gas emissions in the transportation sector by 20-39%', 'Improvement of air quality in urban areas, benefiting vulnerable communities', 'Increased reliance on public transportation over personal vehicles', 'Enhanced accessibility to sustainable transit options for low-income individuals', 'Creation of job opportunities in the green technology sector']",,,
c40_0029,EV Fleet,['mitigation'],,,['transportation'],['on-road'],['ghg_reduction'],"['programs_and_initiatives', 'infrastructure_investments']","""EV Fleet"" initiatives involve transitioning municipal vehicle fleets to electric vehicles (EVs). By embracing electric transportation, cities reduce emissions, lower air pollution, and contribute to the overall adoption of sustainable and eco-friendly mobility solutions.","The targeted behavioral change that the ""EV Fleet"" initiative aims to achieve is the increased adoption and use of electric vehicles (EVs) among municipal fleets and, by extension, the general public. This shift is expected to result in a broader acceptance of electric transportation as a viable and sustainable mobility option, leading to reduced reliance on fossil fuel-powered vehicles. The initiative encourages individuals and organizations to perceive EVs as a convenient, environmentally friendly, and socially responsible choice, ultimately contributing to a significant reduction in greenhouse gas emissions and improved air quality in urban areas.","{'air_quality': 1, 'water_quality': 0, 'habitat': 0, 'cost_of_living': 0, 'housing': 0, 'mobility': 0, 'stakeholder_engagement': 0}","The ""EV Fleet"" initiatives promote equity and inclusion in several ways:

1. **Improved Air Quality**: By reducing emissions and lowering air pollution, these initiatives directly benefit vulnerable and underserved communities that are often disproportionately affected by poor air quality and related health issues.

2. **Access to Clean Transportation**: Transitioning to electric vehicles can enhance access to cleaner transportation options for low-income neighborhoods, which may rely on municipal services for mobility.

3. **Job Creation**: The implementation of EV fleets can create job opportunities in the maintenance, operation, and infrastructure development of electric vehicles, providing economic benefits to underserved communities.

4. **Community Engagement**: These initiatives often involve community input and engagement, ensuring that the needs and concerns of marginalized groups are considered in the planning and execution of the fleet transition.

5. **Long-term Cost Savings**: By investing in electric vehicles, municipalities can reduce operational costs over time, potentially allowing for reinvestment in community services that benefit low-income populations.

6. **Sustainable Development**: The focus on sustainable and eco-friendly mobility solutions aligns with broader goals of social equity, ensuring that all community members can benefit from advancements in transportation technology.","{'stationary_energy': None, 'transportation': '0-19', 'waste': None, 'ippu': None, 'afolu': None}",,high,5-10 years,"['Availability of charging infrastructure for electric vehicles', 'Access to funding and financial incentives for purchasing EVs', 'Support from local government and policy frameworks promoting EV adoption', 'Public awareness and acceptance of electric vehicles', 'Availability of a reliable supply chain for EVs and related components', 'Training and resources for maintenance and operation of EVs']","['Number of electric vehicles in the fleet', 'Reduction in greenhouse gas emissions', 'Decrease in air pollution levels', 'Cost savings on fuel and maintenance', 'Percentage of fleet transitioned to electric', 'Increase in public awareness and acceptance of EVs', 'Reduction in fossil fuel consumption', 'Miles driven by electric vehicles', 'Charging infrastructure availability', 'Operational efficiency improvements']","['Reduction in greenhouse gas emissions from transportation', 'Improved air quality benefiting vulnerable communities', 'Increased adoption of electric vehicles among municipal fleets', 'Job creation in EV maintenance and infrastructure', 'Enhanced access to clean transportation for low-income neighborhoods', 'Long-term cost savings for municipalities leading to reinvestment in community services']",,,
c40_0030,EV Charging,['mitigation'],,,['transportation'],,['ghg_reduction'],,,,"{'air_quality': None, 'water_quality': None, 'habitat': None, 'cost_of_living': None, 'housing': None, 'mobility': None, 'stakeholder_engagement': 0}",,,,,,[],[],[],,,
c40_0031,Smart Transit,['mitigation'],,,['transportation'],['all'],['ghg_reduction'],"['programs_and_initiatives', 'infrastructure_investments']","""Smart Transit"" involves the integration of advanced technologies and data-driven solutions to enhance the efficiency and effectiveness of public transportation systems. By incorporating smart technologies, cities aim to optimize transit routes, improve service reliability, and provide a more seamless and sustainable commuting experience for residents.","The targeted behavioral shift that the ""Smart Transit"" climate action aims to achieve is an increased reliance on public transportation among residents. By enhancing the efficiency, reliability, and convenience of public transit systems through advanced technologies, the initiative seeks to encourage individuals to choose public transit over personal vehicles for their commuting needs. This shift is expected to reduce greenhouse gas emissions by decreasing the number of cars on the road, thereby promoting a more sustainable and environmentally friendly mode of transportation.","{'air_quality': 1, 'water_quality': 0, 'habitat': 0, 'cost_of_living': 1, 'housing': 0, 'mobility': 2, 'stakeholder_engagement': 0}","The ""Smart Transit"" initiative promotes equity and inclusion by enhancing public transportation systems that are crucial for vulnerable and underserved communities. By optimizing transit routes and improving service reliability, the action ensures that these communities have better access to essential services, job opportunities, and educational resources. 

Additionally, the integration of advanced technologies can help address the specific needs of underserved populations, such as those with disabilities or low-income individuals, by providing real-time information and more efficient transit options. This focus on creating a seamless commuting experience fosters inclusivity, allowing all residents, regardless of their socioeconomic status, to benefit from improved public transportation. Overall, the initiative actively considers the needs of marginalized groups, ensuring that climate action contributes to social equity.","{'stationary_energy': None, 'transportation': '0-19', 'waste': None, 'ippu': None, 'afolu': None}",,medium,5-10 years,"['Availability of advanced technologies for data collection and analysis', 'Investment in infrastructure to support smart transit systems', 'Collaboration between government agencies, transit authorities, and technology providers', 'Public acceptance and user engagement with smart transit solutions', 'Access to real-time data for route optimization and service reliability', 'Sustainable funding models to maintain and upgrade transit systems']","['Reduction in greenhouse gas emissions', 'Increase in public transit ridership', 'Average wait time for public transit', 'On-time performance percentage', 'Customer satisfaction score', 'Cost savings from optimized routes', 'Percentage of transit fleet using clean energy', 'Reduction in transit operational costs', 'Frequency of service disruptions', 'Integration of real-time data usage by commuters']","['Reduction in greenhouse gas emissions from decreased reliance on personal vehicles', 'Improved air quality due to reduced vehicle emissions', 'Enhanced mobility and accessibility for underserved communities', 'Lower transportation costs for residents', 'Increased public transit usage leading to a more sustainable commuting culture', 'Promotion of social equity through improved access to essential services']",,,
