ActionID,ActionName,ActionType,AdaptationCategory,Hazard,Sector,Subsector,PrimaryPurpose,InterventionType,Description,BehavioralChangeTargeted,CoBenefits,EquityAndInclusionConsiderations,GHGReductionPotential,AdaptionEffectiveness,CostInvestmentNeeded,TimelineForImplementation,Dependencies,KeyPerformanceIndicators,Impacts,Intervention Type,BehaviouralChangeTargeted,AdaptationEffectiveness
c40_0047,Water Storage,['adaptation'],Eco-engineering,['droughts'],,,['climate_resilience'],,"""Water Storage"" and pump storage solutions enhance water resource management, ensuring availability during periods of scarcity. This adaptation strategy contributes to sustainable water use and resilience to climate-related challenges.",,"{'air_quality': 0, 'water_quality': 1, 'habitat': 0, 'cost_of_living': 0, 'housing': 0, 'mobility': 0, 'stakeholder_engagement': 0}","The ""Water Storage"" and pump storage solutions directly promote equity and inclusion by ensuring that vulnerable or underserved communities have access to reliable water resources, particularly during times of scarcity. By enhancing water resource management, these solutions help to mitigate the disproportionate impacts of climate change on marginalized populations who often face greater challenges in accessing clean and sufficient water. 

Additionally, the focus on sustainable water use supports the long-term resilience of these communities, allowing them to better cope with climate-related challenges. This action recognizes the specific needs of underserved populations, ensuring that they are not left behind in the face of water scarcity and climate impacts, thereby fostering a more equitable distribution of resources and opportunities for all.",,high,medium,5-10 years,"['Availability of suitable sites for water storage infrastructure', 'Access to technology for efficient pump storage systems', 'Investment and funding for construction and maintenance of water storage facilities', 'Regulatory frameworks supporting water resource management', 'Community engagement and support for water management initiatives', 'Climate data and forecasting to inform water storage needs']","['Volume of water stored', 'Percentage reduction in water scarcity incidents', 'Rate of water usage efficiency', 'Number of communities benefiting from water storage solutions', 'Cost savings from improved water management', 'Increase in agricultural productivity due to reliable water supply', 'Resilience score of local ecosystems', 'Frequency of maintenance and operational issues in storage systems']","['Enhances water resource management', 'Increases resilience to droughts', 'Promotes equity and inclusion for underserved communities', 'Improves water quality', 'Supports sustainable water use']",,,
c40_0048,Improved Drainage,['adaptation'],Eco-engineering,['floods'],,,['climate_resilience'],,"""Improved Drainage"" involves eco-engineering solutions to enhance drainage systems, mitigating the risk of flooding. This adaptation measure aims to improve urban resilience by minimizing the impact of extreme weather events.",,"{'air_quality': 0, 'water_quality': 0, 'habitat': 0, 'cost_of_living': 0, 'housing': 0, 'mobility': 0, 'stakeholder_engagement': 0}","The ""Improved Drainage"" climate action promotes equity and inclusion by specifically targeting vulnerable or underserved communities that are often disproportionately affected by flooding and extreme weather events. By implementing eco-engineering solutions, the action addresses the needs of these communities, ensuring that they benefit from enhanced urban resilience. 

Additionally, the focus on improving drainage systems helps to protect low-income neighborhoods, which may lack adequate infrastructure, thereby reducing their risk of flooding and associated damages. This proactive approach not only safeguards the physical environment but also supports the social and economic stability of these communities, fostering a more equitable urban landscape. 

Overall, the action recognizes the unique challenges faced by underserved populations and aims to create a more inclusive urban environment by prioritizing their safety and well-being in the face of climate change.",,high,medium,5-10 years,"['Availability of funding for eco-engineering projects', 'Collaboration with local governments and stakeholders for planning and implementation', 'Access to advanced technology and materials for drainage improvement', 'Data on historical weather patterns and flood risks for effective design', 'Community engagement and support for adaptation measures']","['Reduction in flood incidents', 'Improvement in drainage capacity', 'Response time to flooding events', 'Percentage of urban areas with upgraded drainage systems', 'Community satisfaction with drainage improvements', 'Cost-effectiveness of eco-engineering solutions', 'Biodiversity enhancement in drainage areas', 'Reduction in waterlogging duration', 'Increase in green infrastructure integration']","['Enhanced urban resilience against flooding', 'Protection of vulnerable communities from extreme weather events', 'Improved safety and well-being for underserved populations', 'Support for social and economic stability in low-income neighborhoods']",,,
c40_0049,Cyclone Shelters,['adaptation'],Eco-engineering,['floods'],,,['climate_resilience'],,"""Cyclone Shelters"" provide safe havens during flood and cyclone events, enhancing community resilience. This eco-engineering adaptation ensures the safety of residents in vulnerable areas during extreme weather conditions.",,"{'air_quality': 0, 'water_quality': 0, 'habitat': 0, 'cost_of_living': 0, 'housing': 0, 'mobility': 0, 'stakeholder_engagement': 0}","The ""Cyclone Shelters"" initiative promotes equity and inclusion by specifically targeting vulnerable communities that are most at risk during extreme weather events. By providing safe havens in areas prone to flooding and cyclones, the action directly addresses the needs of underserved populations who may lack the resources to evacuate or protect themselves during such disasters. 

Additionally, the eco-engineering aspect of the shelters ensures that the solutions are sustainable and environmentally friendly, which can benefit the community as a whole, including marginalized groups. The focus on community resilience fosters a sense of collective safety and empowerment, allowing residents to feel more secure in the face of climate-related challenges. Overall, this action acknowledges and prioritizes the safety and well-being of those who are often disproportionately affected by climate change.",,high,low,<5 years,"['Availability of suitable land for constructing cyclone shelters', 'Funding and financial resources for building and maintaining shelters', 'Community engagement and support for the initiative', 'Access to materials and technology for eco-engineering solutions', 'Collaboration with local government and disaster management agencies', 'Training and preparedness programs for residents on using the shelters effectively']","['Number of cyclone shelters constructed', 'Capacity of shelters (number of people accommodated)', 'Frequency of use during extreme weather events', 'Community awareness and preparedness training sessions conducted', 'Reduction in casualties during cyclone events', 'Time taken for evacuation to shelters', 'Post-event satisfaction surveys from shelter users', 'Maintenance and operational readiness of shelters']","['Enhances community resilience during extreme weather events', 'Provides safe havens for vulnerable populations', 'Promotes equity and inclusion for underserved communities', 'Supports sustainable and environmentally friendly solutions', 'Fosters a sense of collective safety and empowerment']",,,
c40_0050,White Roofs,['adaptation'],Eco-engineering,['heatwaves'],,,['climate_resilience'],,"""White Roofs"" utilize eco-engineering by adopting reflective roofing materials to reduce heat absorption. This adaptation strategy helps mitigate the urban heat island effect, contributing to more sustainable and climate-resilient buildings.",,"{'air_quality': 0, 'water_quality': 0, 'habitat': 0, 'cost_of_living': 0, 'housing': 0, 'mobility': 0, 'stakeholder_engagement': 0}","The ""White Roofs"" climate action promotes equity and inclusion by specifically targeting urban areas where vulnerable or underserved communities often reside. These communities are typically more affected by the urban heat island effect, leading to higher temperatures and increased energy costs. By implementing reflective roofing materials, this action directly addresses the disproportionate heat exposure faced by these populations, thereby improving their living conditions.

Additionally, the initiative can create job opportunities in the installation and maintenance of white roofs, providing economic benefits to local residents, particularly those from underserved backgrounds. This not only enhances community resilience but also fosters a sense of ownership and involvement in climate action efforts.

Overall, the ""White Roofs"" strategy is designed to alleviate environmental burdens on marginalized communities, ensuring that they benefit from climate adaptation measures and promoting a more equitable urban environment.",,high,low,<5 years,"['Availability of reflective roofing materials', 'Awareness and acceptance of eco-engineering practices among builders and homeowners', 'Regulatory support and incentives for implementing white roofs', 'Access to funding for retrofitting existing buildings', 'Collaboration between urban planners and environmental organizations']","['Reduction in surface temperature', 'Percentage of buildings with white roofs', 'Energy savings from reduced cooling costs', 'Decrease in urban heat island effect', 'Increase in albedo values of roofing materials', 'Reduction in greenhouse gas emissions', 'Improvement in indoor thermal comfort', 'Community engagement and participation rates']","['Mitigates urban heat island effect', 'Improves living conditions for vulnerable communities', 'Creates job opportunities in installation and maintenance', 'Enhances community resilience', 'Promotes equity and inclusion in climate adaptation']",,,
c40_0051,Public Shading,['adaptation'],Eco-engineering,['heatwaves'],,,['climate_resilience'],,"""Public Shading"" involves the implementation of shade structures in public spaces, contributing to eco-engineering efforts. This adaptation measure enhances outdoor comfort, reduces heat stress, and promotes sustainable urban design.",,"{'air_quality': 0, 'water_quality': 0, 'habitat': 0, 'cost_of_living': 0, 'housing': 0, 'mobility': 0, 'stakeholder_engagement': 0}","The ""Public Shading"" climate action promotes equity and inclusion by ensuring that vulnerable or underserved communities have access to comfortable and safe outdoor spaces. By implementing shade structures in public areas, this initiative directly addresses the needs of populations that may be disproportionately affected by heat stress, such as low-income families, the elderly, and individuals with health conditions. 

Additionally, the focus on public spaces ensures that all community members, regardless of socioeconomic status, can benefit from the enhanced outdoor comfort provided by these shade structures. This action fosters inclusive urban design by prioritizing the well-being of those who may lack access to private shaded areas, thereby promoting social equity in the face of climate challenges.",,high,low,<5 years,"['Availability of funding for the construction and maintenance of shade structures', 'Collaboration with urban planners and architects for design integration', 'Community engagement to ensure public support and usage', 'Access to suitable materials that are environmentally friendly', 'Compliance with local regulations and zoning laws regarding public space modifications']","['Number of shade structures installed', 'Increase in public space usage', 'Reduction in surface temperature', 'Decrease in heat-related health incidents', 'User satisfaction ratings', 'Biodiversity improvement in shaded areas', 'Energy savings in nearby buildings', 'Community engagement and participation rates']","['Enhances outdoor comfort', 'Reduces heat stress', 'Promotes sustainable urban design', 'Improves equity and inclusion for vulnerable communities', 'Addresses needs of low-income families and the elderly', 'Fosters social equity in public spaces']",,,
c40_0052,Cool Pavement,['adaptation'],Eco-engineering,['heatwaves'],,,['climate_resilience'],,"""Cool Pavement"" initiatives involve the use of reflective materials to reduce pavement heat absorption. This adaptation strategy contributes to mitigating heat-related challenges, enhancing urban resilience in the context of heating and cooling.",,"{'air_quality': 0, 'water_quality': 0, 'habitat': 0, 'cost_of_living': 0, 'housing': 0, 'mobility': 0, 'stakeholder_engagement': 0}","The ""Cool Pavement"" initiatives promote equity and inclusion by specifically targeting urban areas where vulnerable or underserved communities often reside. These communities are typically more affected by heat-related challenges due to factors such as limited access to green spaces, inadequate housing, and socio-economic disparities. By implementing reflective materials that reduce heat absorption, the initiative directly addresses the disproportionate impact of urban heat islands on these populations, thereby improving their living conditions.

Additionally, the initiative can enhance urban resilience for these communities by lowering ambient temperatures, which can lead to reduced energy costs and improved public health outcomes. This is particularly important for low-income households that may struggle with high energy bills and health issues related to extreme heat. By focusing on areas with the greatest need, the ""Cool Pavement"" initiatives ensure that the benefits of climate action are equitably distributed, fostering a more inclusive approach to urban planning and climate resilience.",,high,low,5-10 years,"['Availability of reflective materials suitable for urban infrastructure', 'Support from local government and urban planners for implementation', 'Funding and investment for the installation of cool pavement', 'Public awareness and acceptance of cool pavement initiatives', 'Collaboration with environmental and community organizations for outreach and education']","['Reduction in surface temperature of pavements', 'Percentage of area covered by cool pavements', 'Decrease in urban heat island effect', 'Energy savings in nearby buildings', 'Reduction in heat-related health incidents', 'Increase in public awareness and engagement', 'Cost-effectiveness of implementation', 'Longevity and durability of materials used']","['Mitigates heat-related challenges', 'Enhances urban resilience', 'Improves living conditions for vulnerable communities', 'Reduces energy costs for low-income households', 'Addresses urban heat islands', 'Promotes equity in urban planning']",,,
c40_0053,Water Savings,['adaptation'],Technological actions,['droughts'],,,['climate_resilience'],,"""Water Savings"" technologies, including rainwater harvesting, aim to conserve water resources. This adaptation measure involves technological actions to enhance eco-engineering efforts, ensuring sustainable water use in the face of changing climate conditions.",,"{'air_quality': 0, 'water_quality': 1, 'habitat': 0, 'cost_of_living': 0, 'housing': 0, 'mobility': 0, 'stakeholder_engagement': 0}","The ""Water Savings"" technologies, such as rainwater harvesting, promote equity and inclusion by directly addressing the needs of vulnerable and underserved communities that often face water scarcity and limited access to clean water resources. By implementing these technologies, the action ensures that marginalized populations can benefit from sustainable water use practices, which are crucial for their health and livelihoods.

Additionally, the focus on eco-engineering efforts in this climate action highlights the importance of integrating local knowledge and community involvement in the design and implementation of water conservation strategies. This participatory approach empowers underserved communities, giving them a voice in the decision-making process and fostering a sense of ownership over the water resources.

Furthermore, the adaptation measure is particularly relevant for communities that are disproportionately affected by climate change, as it provides them with tools to enhance their resilience against water-related challenges. By prioritizing these communities in the deployment of water-saving technologies, the action contributes to reducing inequalities and promoting social justice in the context of climate adaptation.",,high,high,<5 years,"['Availability of suitable technology for rainwater harvesting', 'Access to funding for implementing water-saving technologies', 'Community awareness and education on water conservation practices', 'Supportive policies and regulations promoting sustainable water use', 'Collaboration with local governments and organizations for effective implementation']","['Volume of water saved (liters)', 'Number of rainwater harvesting systems installed', 'Percentage reduction in water usage', 'Cost savings from reduced water bills', 'Community engagement and participation rate', 'Increase in local biodiversity', 'Reduction in stormwater runoff', 'User satisfaction with water savings technologies']","['Enhances climate resilience for vulnerable communities', 'Promotes sustainable water use practices', 'Improves water quality', 'Empowers marginalized populations through community involvement', 'Reduces inequalities related to water access']",,,
c40_0054,Water Recycling,['adaptation'],Technological actions,['droughts'],,,['climate_resilience'],,"""Water Recycling"" or reclamation involves technological actions to treat and reuse water resources. This adaptation measure contributes to water resource sustainability and resilience, particularly in the context of changing climate patterns.",,"{'air_quality': 0, 'water_quality': 1, 'habitat': 0, 'cost_of_living': 0, 'housing': 0, 'mobility': 0, 'stakeholder_engagement': 0}","The ""Water Recycling"" action promotes equity and inclusion by ensuring that vulnerable or underserved communities have access to sustainable water resources. By treating and reusing water, this initiative addresses the needs of populations that may face water scarcity or contamination, which often disproportionately affects low-income and marginalized groups. 

Additionally, the implementation of water recycling technologies can create job opportunities and skills training within these communities, fostering economic empowerment and participation in the green economy. The focus on resilience in the face of changing climate patterns also helps to protect these communities from the adverse effects of climate change, ensuring that they are not left behind in the transition to sustainable water management. Overall, this action actively considers the needs and rights of underserved populations, promoting their inclusion in climate adaptation efforts.",,high,high,<5 years,"['Access to advanced water treatment technologies', 'Availability of infrastructure for water collection and distribution', 'Regulatory frameworks supporting water recycling initiatives', 'Public awareness and acceptance of water reuse practices', 'Funding and investment for water recycling projects', 'Collaboration between governmental and non-governmental organizations']","['Volume of water recycled', 'Percentage reduction in freshwater consumption', 'Cost savings from water reuse', 'Energy consumption for water treatment', 'Quality of recycled water', 'Number of facilities implementing water recycling', 'Public awareness and engagement levels', 'Reduction in wastewater discharge', 'Compliance with water quality standards', 'Impact on local ecosystems']","['Enhances water resource sustainability', 'Increases resilience to droughts', 'Improves water quality', 'Promotes equity and inclusion for underserved communities', 'Creates job opportunities and skills training', 'Supports economic empowerment in vulnerable populations']",,,
c40_0055,Green Infrastructure,['adaptation'],Ecosystem-based actions,,,,['climate_resilience'],,,,"{'air_quality': None, 'water_quality': None, 'habitat': None, 'cost_of_living': None, 'housing': None, 'mobility': None, 'stakeholder_engagement': 0}",,,,,,[],[],['Enhancement of climate resilience'],,,
c40_0056,Watershed Preservation,['adaptation'],Ecosystem-based actions,['droughts'],,,['climate_resilience'],,"""Watershed Preservation"" involves the protection and conservation of natural watershed areas to safeguard water quality, biodiversity, and ecosystem services. This initiative aims to ensure sustainable water management and resilience to the impacts of climate change.",,"{'air_quality': 0, 'water_quality': 1, 'habitat': 0, 'cost_of_living': 0, 'housing': 0, 'mobility': 0, 'stakeholder_engagement': 0}","The ""Watershed Preservation"" initiative promotes equity and inclusion by prioritizing the protection of natural resources that are vital for vulnerable and underserved communities. These communities often rely on local watersheds for their drinking water, agriculture, and livelihoods. By safeguarding water quality and ecosystem services, the action directly benefits those who may lack access to clean water and healthy environments.

Additionally, the initiative fosters community engagement by involving local residents in decision-making processes related to watershed management. This inclusion ensures that the voices of marginalized groups are heard and that their specific needs and concerns are addressed in conservation efforts.

Furthermore, by enhancing resilience to climate change impacts, the action helps to mitigate the disproportionate effects that climate change has on underserved populations, thereby promoting social equity. Overall, the focus on sustainable water management and biodiversity conservation aligns with the needs of vulnerable communities, ensuring they are not left behind in climate action efforts.",,high,low,<5 years,"['Effective land use planning to prevent urban sprawl and habitat destruction', 'Community engagement and education to promote awareness and participation in watershed conservation', 'Collaboration with local governments and organizations for policy support and resource allocation', 'Monitoring and assessment of water quality and ecosystem health to inform management practices', 'Funding and financial resources to support conservation projects and initiatives']","['Water quality index', 'Biodiversity index', 'Area of watershed preserved', 'Number of conservation projects initiated', 'Community engagement level', 'Reduction in water pollution incidents', 'Ecosystem service valuation', 'Resilience assessment score', 'Water usage efficiency', 'Monitoring and reporting frequency']","['Improved water quality for vulnerable communities', 'Enhanced climate resilience for underserved populations', 'Increased community engagement in watershed management', 'Protection of biodiversity and ecosystem services']",,,
c40_0057,Food Redistribution,['adaptation'],Services actions,,,,['climate_resilience'],,"""Food Redistribution"" programs focus on minimizing food waste by redirecting surplus food to those in need. This initiative contributes to sustainable food systems, reduces environmental impact, and addresses issues of food insecurity within the community.",,"{'air_quality': 0, 'water_quality': 0, 'habitat': 0, 'cost_of_living': 1, 'housing': 0, 'mobility': 0, 'stakeholder_engagement': 0}","The ""Food Redistribution"" programs promote equity and inclusion by directly addressing food insecurity, which disproportionately affects vulnerable and underserved communities. By redirecting surplus food to those in need, the initiative ensures that marginalized populations have access to nutritious food, thereby reducing disparities in food access. Additionally, the program minimizes food waste, contributing to environmental sustainability, which benefits all community members, including those who are often overlooked in climate action discussions. This approach fosters a sense of community and solidarity, as it involves collaboration between food donors and recipients, ensuring that the voices and needs of underserved populations are recognized and prioritized in the food system.",,,low,<5 years,"['Collaboration with local food producers and retailers to identify surplus food', 'Partnerships with food banks and community organizations for distribution', 'Logistical support for transportation and storage of surplus food', 'Awareness and education programs to encourage community participation', 'Funding and resources to sustain the program']","['Amount of food redistributed (in pounds or kilograms)', 'Number of beneficiaries served', 'Reduction in food waste (percentage)', 'Number of partnerships with local food businesses', 'Community engagement metrics (e.g., volunteer hours)', 'Cost savings for beneficiaries', 'Environmental impact metrics (e.g., carbon footprint reduction)', 'Frequency of food distribution events']","['Reduces food waste', 'Addresses food insecurity', 'Promotes equity and inclusion', 'Supports community collaboration', 'Contributes to sustainable food systems', 'Improves cost of living for vulnerable populations']",,,
