ActionID,ActionName,ActionType,AdaptationCategory,Hazard,Sector,Subsector,PrimaryPurpose,InterventionType,Description,BehavioralChangeTargeted,CoBenefits,EquityAndInclusionConsiderations,GHGReductionPotential,AdaptationEffectiveness,CostInvestmentNeeded,TimelineForImplementation,Dependencies,KeyPerformanceIndicators,Impacts
ipcc_0040,Design with Less / Lightweighting of Products,['mitigation'],,,['ippu'],['industrial_processes'],['ghg_reduction'],"['programs_and_initiatives', 'regulations_and_laws', 'incentives_and_subsidies']","This action involves improving material efficiency by designing lighter products, optimizing material usage to maintain functionality, and incorporating circular economy principles such as reusability, repairability, and recyclability. It spans the entire product lifecycle, from design to end-of-life management.","Encourages adoption of efficient material use practices, longer product lifespans, and repair/reuse behaviors among manufacturers and consumers.","{'air_quality': 0, 'water_quality': 0, 'habitat': 0, 'cost_of_living': 0, 'housing': 0, 'mobility': 0, 'stakeholder_engagement': 0}","Promotes access to durable, affordable products for underserved communities and reduces waste in resource-constrained regions.","{'stationary_energy': None, 'transportation': None, 'waste': None, 'ippu': '40-59', 'afolu': None}",,medium,5-10 years,"['Availability of advanced materials', 'supportive policies for circular economy', 'stakeholder collaboration across supply chains', 'investment in R&D for lightweight materials', 'high-efficiency design methods']","['Reduction in material usage per product', 'increase in product lifespan', 'percentage of materials recovered and reused', 'reduction in GHG emissions from production processes']","['Reduced environmental footprint', 'lower production costs', 'improved resource efficiency', 'enhanced sustainability of industrial processes']"
ipcc_0041,Improved Material Utilization (Near-Net Shape Casting),['mitigation'],,,['ippu'],['industrial_processes'],['ghg_reduction'],"['infrastructure_investments', 'programs_and_initiatives', 'regulations_and_laws']","This action focuses on enhancing material efficiency by adopting near-net shape casting and similar innovative manufacturing techniques. These methods reduce material wastage during production, improve yield from raw materials, and enhance energy efficiency by minimizing reprocessing. Strategies include optimizing product design, lightweighting, and improving recycling and reuse processes.","Encourages manufacturers to adopt innovative manufacturing processes, optimize material usage, and reduce production waste.","{'air_quality': 0, 'water_quality': 0, 'habitat': 0, 'cost_of_living': 0, 'housing': 0, 'mobility': 0, 'stakeholder_engagement': 0}","Promotes access to advanced material-efficient technologies for industries of all scales, enabling smaller enterprises to participate in sustainable manufacturing practices.","{'stationary_energy': None, 'transportation': None, 'waste': None, 'ippu': '40-59', 'afolu': None}",,medium,5-10 years,"['Availability of advanced manufacturing technologies', 'workforce training', 'supportive regulations', 'access to materials for near-net shape casting']","['Reduction in material waste', 'increase in production yield', 'reduction in GHG emissions per unit of material produced']","['Significant reduction in material and energy use', 'enhanced production efficiency', 'reduced emissions', 'improved sustainability across industrial supply chains']"
ipcc_0042,"Design for Recovery, Reuse, or Repurposing",['mitigation'],,,['ippu'],['industrial_processes'],['ghg_reduction'],"['programs_and_initiatives', 'infrastructure_investments', 'regulations_and_laws']","This action involves designing products to enable circular principles such as extended product life, reusability, repairability, and ease of recycling. It emphasizes lightweighting, material optimization, and improved recovery of materials at the end of their lifecycle through reuse, remanufacturing, or recycling.","Encourages stakeholders to adopt circular economy principles, reduce waste, and prioritize designing products for longevity and efficient material recovery.","{'air_quality': 0, 'water_quality': 0, 'habitat': 0, 'cost_of_living': 0, 'housing': 0, 'mobility': 0, 'stakeholder_engagement': 0}","Ensures equitable access to advanced recycling and repurposing technologies, creating opportunities for underserved communities to participate in sustainable material management initiatives.","{'stationary_energy': None, 'transportation': None, 'waste': None, 'ippu': '40-59', 'afolu': None}",,high,5-10 years,"['Collaboration across supply chains', 'advances in recycling and remanufacturing technologies', 'supportive policy frameworks to incentivize adoption']","['Percentage of materials recovered and reused', 'reduction in production waste', 'decrease in GHG emissions per unit of product lifecycle']","['Reduction in raw material demand', 'improved environmental sustainability', 'decreased emissions', 'enhanced industrial efficiency']"
ipcc_0043,Circular Economy Policies,['mitigation'],,,['ippu'],['industrial_processes'],['ghg_reduction'],"['regulations_and_laws', 'incentives_and_subsidies', 'programs_and_initiatives', 'infrastructure_investments']","Circular Economy (CE) policies aim to close the loop for materials and energy flows by reducing, reusing, and recycling resources. These policies promote durable goods, reuse and remanufacturing, industrial symbiosis, and urban symbiosis to minimize waste and reduce GHG emissions. CE policies operate at micro, meso, and macro levels to integrate strategies like eco-design, sustainable supply chains, and urban energy symbiosis.","Encourages adoption of sustainable production practices, consumer participation in recycling, and cross-sectoral collaboration to reduce resource extraction and waste generation.","{'air_quality': 0, 'water_quality': 0, 'habitat': 0, 'cost_of_living': 0, 'housing': 0, 'mobility': 0, 'stakeholder_engagement': 0}","Promotes access to CE practices for small and medium-sized enterprises (SMEs), ensures equitable participation in industrial symbiosis networks, and supports underserved regions by creating economic opportunities through resource-efficient policies.","{'stationary_energy': None, 'transportation': None, 'waste': None, 'ippu': '40-59', 'afolu': None}",,high,5-10 years,"['Effective coordination between industries, governments, and communities', 'supportive policies and regulations', 'development of recycling infrastructure', 'data sharing platforms for material and energy flows']","['Reduction in virgin material use', 'GHG emissions avoided through CE practices', 'increase in recycling rates', 'number of industrial symbiosis networks implemented', 'resource recovery metrics']","['Significant reductions in resource extraction, energy use, and emissions', 'enhanced regional development through eco-industrial parks', 'broader adoption of sustainable practices across industries and urban areas']"
ipcc_0044,Alternative feedstocks (e.g. in cement),['mitigation'],,,['ippu'],['industrial_processes'],['ghg_reduction'],"['programs_and_initiatives', 'infrastructure_investments', 'incentives_and_subsidies']","Utilizing alternative feedstocks, such as blast furnace slag, fly ash, and pozzolans, to reduce the clinker-to-cement ratio in cement production. These alternatives lower emissions associated with calcination and energy-intensive processes. Improved material efficiency through high-strength concretes and innovative placement methods further reduces material usage.",Encourages the adoption of alternative materials and innovative construction practices to reduce reliance on traditional clinker-intensive cement production.,"{'air_quality': 1, 'water_quality': 0, 'habitat': 0, 'cost_of_living': 0, 'housing': 0, 'mobility': 0, 'stakeholder_engagement': 0}","Promotes equitable access to innovative cement technologies and ensures benefits are shared across both developed and developing nations, fostering inclusive construction practices.","{'stationary_energy': None, 'transportation': None, 'waste': None, 'ippu': '40-59', 'afolu': None}",,high,5-10 years,"['Development and availability of alternative feedstocks', 'regulatory support for material substitution', 'investment in research and development for innovative concrete applications']","['Reduction in clinker-to-cement ratio', 'lower CO2 emissions per tonne of cement', 'increased adoption of alternative materials in cement production']","['Reduced GHG emissions', 'enhanced resource efficiency', 'lower energy consumption in cement production', 'improved environmental quality in cement manufacturing regions']"
ipcc_0045,"Behavioral Changes for Reduced Waste (e.g., Food)",['mitigation'],,,['ippu'],['industrial_processes'],['ghg_reduction'],"['programs_and_initiatives', 'incentives_and_subsidies', 'regulations_and_laws']","Encouraging behavioral changes to reduce waste in industrial processes and consumer habits, particularly in food production and consumption. This includes reducing food waste through better planning, optimizing portion sizes, and improving recycling and reuse practices in production and post-consumption stages.","Encourages individuals and industries to adopt waste-reduction strategies, reduce overproduction, optimize food usage, and recycle waste effectively.","{'air_quality': 1, 'water_quality': 0, 'habitat': 0, 'cost_of_living': 1, 'housing': 0, 'mobility': 0, 'stakeholder_engagement': 1}","Promotes fair access to education and resources for waste reduction, particularly for low-income and underserved communities to improve resource efficiency and reduce waste management costs.","{'stationary_energy': None, 'transportation': None, 'waste': None, 'ippu': '20-39', 'afolu': None}",,medium,<5 years,"['Availability of infrastructure for waste collection and recycling', 'public awareness campaigns', 'supportive policy frameworks']","['Reduction in food waste percentage', 'increased recycling rates', 'reduced greenhouse gas emissions from waste management']","['Reduced environmental burden', 'enhanced resource efficiency', 'improved urban livability', 'cost savings in waste management systems']"
ipcc_0046,Optimised Dosing of Consumable Products,['mitigation'],,,['ippu'],['product_use'],['ghg_reduction'],"['programs_and_initiatives', 'regulations_and_laws']",Encourages precise use of consumable products like detergents and fertilizers to minimize material and energy waste while maximizing product-service efficiency. This strategy aims to reduce material intensity and waste production in the industry sector.,"Promotes behavioral changes in the precise use of products, such as following recommended doses for consumables and minimizing waste in production processes.","{'air_quality': 0, 'water_quality': 0, 'habitat': 0, 'cost_of_living': 0, 'housing': 0, 'mobility': 0, 'stakeholder_engagement': 0}","Ensures equitable access to educational resources and guidelines on the optimized use of consumables, benefitting underserved communities by reducing costs and improving efficiency.","{'stationary_energy': None, 'transportation': None, 'waste': None, 'ippu': '20-39', 'afolu': None}",,low,<5 years,"['Requires clear guidelines', 'consumer education campaigns', 'industry compliance with precise dosing recommendations']","['Reduction in material waste', 'increased adherence to dosing guidelines', 'measurable decreases in associated emissions']","['Reduced industrial emissions', 'lower resource consumption', 'cost savings for consumers and industries', 'improved efficiency across the supply chain']"
ipcc_0047,Enhanced product service levels per product (e.g. product sharing),['mitigation'],,,['ippu'],['industrial_processes'],['ghg_reduction'],"['programs_and_initiatives', 'incentives_and_subsidies']","Promotes more intensive use of durable products by encouraging product sharing, which reduces the demand for new products and the associated GHG emissions from their manufacturing and supply chain.",Encourages users to share durable products and adopt product-service systems that emphasize using goods more efficiently rather than owning them individually.,"{'air_quality': 0, 'water_quality': 0, 'habitat': 0, 'cost_of_living': 1, 'housing': 0, 'mobility': 1, 'stakeholder_engagement': 1}","Supports equitable access to goods and services by reducing ownership costs, enabling underserved communities to participate in product-sharing initiatives.","{'stationary_energy': None, 'transportation': None, 'waste': None, 'ippu': '40-59', 'afolu': None}",,medium,5-10 years,"['Development of platforms and systems to facilitate product sharing', 'stakeholder collaboration', 'supportive policies to incentivize shared usage models']","['Number of shared product-service systems implemented', 'reduction in material demand per capita', 'decrease in GHG emissions from product manufacturing']","['Reduction in resource use and emissions', 'cost savings for consumers', 'increased accessibility to products', 'fostering a circular economy through more efficient use of materials']"
ipcc_0048,Design for extended product life-time,['mitigation'],,,['ippu'],['product_use'],['ghg_reduction'],"['programs_and_initiatives', 'infrastructure_investments', 'regulations_and_laws']","Designing products with longer lifespans, increased reusability, repairability, and recyclability to reduce material use and improve resource efficiency. This includes optimizing product designs to minimize material consumption and emissions, supporting a circular economy.","Encourages manufacturers and consumers to prioritize durability, reuse, and efficient use of materials to reduce waste and emissions.","{'air_quality': 0, 'water_quality': 0, 'habitat': 0, 'cost_of_living': 0, 'housing': 0, 'mobility': 0, 'stakeholder_engagement': 1}","Promotes affordability of durable and reusable products, ensuring low-income populations have access to long-lasting, high-quality goods.","{'stationary_energy': None, 'transportation': None, 'waste': None, 'ippu': '40-59', 'afolu': None}",,medium,5-10 years,"['Requires collaboration across material supply chains', 'advancements in product design', 'supportive policy frameworks to incentivize circular economy practices']","['Reduction in material use per product', 'increase in product lifespan', 'rate of reuse and repair', 'reduction in GHG emissions from material production and waste']","['Significant emissions reductions', 'resource conservation', 'cost savings for consumers', 'strengthened circular economy practices']"
ipcc_0049,Improved product stock maintenance to extend life-time,['mitigation'],,,['ippu'],['industrial_processes'],['ghg_reduction'],"['infrastructure_investments', 'programs_and_initiatives']",Extending the lifespan of buildings and infrastructure by maintaining their structural integrity through improved product stock maintenance. This involves ensuring concrete structures remain functional for over 200 years.,Encourages extending the lifetime of concrete structures and promoting more sustainable construction and maintenance practices.,"{'air_quality': 0, 'water_quality': 0, 'habitat': 0, 'cost_of_living': 0, 'housing': 0, 'mobility': 0, 'stakeholder_engagement': 0}","Supports affordable infrastructure by reducing the need for frequent rebuilding, benefiting underserved and resource-limited communities.","{'stationary_energy': None, 'transportation': None, 'waste': None, 'ippu': '40-59', 'afolu': None}",,medium,5-10 years,"['Development of advanced maintenance techniques', 'effective policies to promote longer building lifespans', 'education for construction professionals on durable practices']","['Increase in the average lifespan of buildings and infrastructure', 'reduction in cement demand per capita', 'overall CO2 emissions reductions in cement production']","['Reduction in demand for new concrete and cement production', 'reduced emissions', 'enhanced resource efficiency', 'increased affordability and sustainability of infrastructure']"
ipcc_0050,Shift to a sufficiency behaviour,['mitigation'],,,['ippu'],['industrial_processes'],['ghg_reduction'],"['programs_and_initiatives', 'regulations_and_laws', 'incentives_and_subsidies']","Promotes behavioral and consumption changes to reduce overall industrial emissions, emphasizing reduced demand for products, reuse and recycling, and more efficient use of resources.","Encourages reducing overconsumption, reusing materials, adopting sustainable consumption patterns, and reducing waste generation through lifestyle and business model changes.","{'air_quality': 0, 'water_quality': 0, 'habitat': 0, 'cost_of_living': 1, 'housing': 0, 'mobility': 0, 'stakeholder_engagement': 0}","Ensures inclusive participation in sufficiency initiatives, enabling low-income groups to access cost-saving measures while promoting sustainable consumption across all economic strata.","{'stationary_energy': None, 'transportation': None, 'waste': None, 'ippu': '20-39', 'afolu': None}",,low,<5 years,"['Public awareness campaigns', 'supportive policies', 'integration of sustainability into business and governmental frameworks']","['Reduction in material and energy intensity per capita', 'decrease in waste generation rates', 'improvement in recycling and reuse statistics']","['Enhances societal well-being', 'reducing overconsumption', 'lowering environmental impacts', 'fostering long-term sustainability in resource use', 'industrial processes']"
ipcc_0051,Reducing overall demand for product services,['mitigation'],,,['ippu'],['product_use'],['ghg_reduction'],"['programs_and_initiatives', 'incentives_and_subsidies', 'regulations_and_laws']","This action focuses on mitigating climate change by reducing the demand for industrial products and services, particularly in sectors such as clothing and tourism. It emphasizes behavioral and lifestyle changes, such as sustainable consumption patterns, reduced long-haul travel, and lower demand for products linked to excessive material production and emissions.","Promotes sustainable consumption and lifestyle changes, such as reduced reliance on fast fashion, decreased long-haul travel, and responsible use of industrial products to limit resource consumption and emissions.","{'air_quality': 1, 'water_quality': 0, 'habitat': 0, 'cost_of_living': 0, 'housing': 0, 'mobility': 1, 'stakeholder_engagement': 1}","Encourages equitable access to sustainable alternatives, particularly for underserved communities, ensuring reduced environmental impacts without excluding vulnerable populations.","{'stationary_energy': None, 'transportation': None, 'waste': None, 'ippu': '40-59', 'afolu': None}",,medium,5-10 years,"['Implementation of policies and programs promoting sustainable consumption', 'availability of alternatives to high-emission activities', 'societal support for behavioral and lifestyle changes']","['Reduction in demand for high-emission products and services', 'decreased industrial emissions linked to product use', 'increased adoption of sustainable consumption practices']","['Reduction in global GHG emissions', 'improved resource efficiency', 'enhanced sustainability in consumption patterns', 'reduced strain on environmental resources']"
ipcc_0052,Reduce Deforestation and Degradation,['mitigation'],,,['afolu'],['land'],['ghg_reduction'],"['regulations_and_laws', 'programs_and_initiatives', 'infrastructure_investments']","Reducing deforestation and forest degradation conserves carbon pools in forest vegetation and soil by avoiding tree cover loss and disturbance. This involves controlling drivers of deforestation, improving forest governance, and supporting community forest management.","Encourages sustainable land management practices, community engagement in conservation, and improved governance to reduce activities driving deforestation and degradation.","{'air_quality': 1, 'water_quality': 1, 'habitat': 0, 'cost_of_living': 0, 'housing': 0, 'mobility': 0, 'stakeholder_engagement': 0}","Promotes secure land tenure, supports community-based forest management, and ensures participation of marginalized and indigenous groups in decision-making processes.","{'stationary_energy': None, 'transportation': None, 'waste': None, 'ippu': None, 'afolu': '60-79'}",,medium,5-10 years,"['Requires improved governance', 'clear land tenure policies', 'funding for protected areas', 'community participation in forest conservation efforts']","['Reduction in deforestation rates', 'increased forest cover', 'the amount of GHG emissions avoided per year']","['Preserves biodiversity', 'enhances ecosystem services', 'improves air and water quality', 'contributes to climate stabilization', 'sustainable development']"
ipcc_0053,"Afforestation, Reforestation and Forest Ecosystem Restoration",['mitigation'],,,['afolu'],['land'],['ghg_reduction'],"['programs_and_initiatives', 'infrastructure_investments', 'incentives_and_subsidies']","Activities focused on converting land to forests, restoring degraded forests, and prioritizing ecological integrity. Afforestation targets historically non-forested land, while reforestation targets previously forested areas. Efforts include enhancing biodiversity, improving ecosystem services, and increasing carbon sequestration.","Encourages sustainable land management, restoration of degraded ecosystems, and adoption of forest-friendly agricultural practices.","{'air_quality': 0, 'water_quality': 1, 'habitat': 1, 'cost_of_living': 0, 'housing': 0, 'mobility': 0, 'stakeholder_engagement': 0}","Supports local livelihoods, promotes land-use equity, and ensures inclusive stakeholder participation in afforestation and restoration programs.","{'stationary_energy': None, 'transportation': None, 'waste': None, 'ippu': None, 'afolu': '60-79'}",,high,5-10 years,"['Requires funding for land restoration', 'access to suitable species for planting', 'local community engagement', 'monitoring systems for ecosystem integrity and carbon sequestration']","['Area of land reforested or afforested', 'carbon sequestration rates', 'improvement in biodiversity indices', 'ecosystem service metrics such as water regulation and soil quality']","['Increased carbon sequestration', 'improved biodiversity', 'enhanced ecosystem resilience', 'better water regulation', 'soil stabilization', 'support for local communities through sustainable resource use']"
ipcc_0054,Improved Forest Management,['mitigation'],,,['afolu'],['land'],['ghg_reduction'],"['incentives_and_subsidies', 'programs_and_initiatives', 'regulations_and_laws']","Sustainable forest management of already managed forests to increase carbon stocks, improve wood quality, mitigate disturbances, and provide co-benefits like biodiversity conservation, water regulation, and soil protection. Includes longer rotations, reduced harvesting, mixed stands, and climate-smart forestry.","Encourages forest owners and managers to adopt sustainable practices, prioritize biodiversity, and reduce harvesting impacts while maintaining productivity.","{'air_quality': 0, 'water_quality': 1, 'habitat': 1, 'cost_of_living': 0, 'housing': 0, 'mobility': 0, 'stakeholder_engagement': 0}","Promotes inclusive participation in forest management and provides support for smallholders and local communities, especially in tropical regions where sustainable practices can enhance livelihoods and mitigate climate change.","{'stationary_energy': None, 'transportation': None, 'waste': None, 'ippu': None, 'afolu': '40-59'}",,high,5-10 years,"['Requires expertise in sustainable forestry', 'investment in nurseries with adapted species', 'supportive policies', 'incentives to overcome economic barriers', 'ensure accessibility for local stakeholders']","['Increase in forest carbon stocks', 'reduction in GHG emissions', 'improvements in biodiversity indicators', 'reduction in soil erosion and water-related issues']","['Improved forest health and resilience', 'enhanced carbon sequestration', 'biodiversity conservation', 'increased ecosystem services like water and soil regulation']"
ipcc_0055,Fire Management (Forest and Grassland / Savanna Fires),['mitigation'],,,['afolu'],['land'],['ghg_reduction'],"['programs_and_initiatives', 'infrastructure_investments', 'regulations_and_laws']","Implementation of fire management practices, including prescribed burning and natural resource management, to reduce uncontrolled wildfires in forests and savannas. Focuses on safeguarding life, property, and resources while mitigating GHG emissions and maintaining carbon stocks.",Encourages adoption of prescribed burning and sustainable fire management practices among communities and land managers to reduce uncontrolled wildfires and their associated GHG emissions.,"{'air_quality': 1, 'water_quality': 0, 'habitat': 0, 'cost_of_living': 0, 'housing': 0, 'mobility': 0, 'stakeholder_engagement': 0}","Promotes equitable access to fire management resources, focusing on capacity building and governance in vulnerable or underserved regions such as least developed countries in Africa.","{'stationary_energy': None, 'transportation': None, 'waste': None, 'ippu': None, 'afolu': '20-39'}",,medium,5-10 years,"['Effective governance frameworks', 'access to research and technology for fire management', 'community engagement', 'alignment with regional legal and policy frameworks']","['Reduction in frequency and intensity of uncontrolled wildfires', 'Area managed with prescribed burns', 'Reduction in GHG emissions from fires', 'Improvement in biodiversity and soil health metrics']","['Reduced GHG emissions', 'improved biodiversity conservation', 'prevention of soil erosion', 'enhanced land productivity', 'reduced risks to life and property from uncontrolled wildfires']"
