ActionID,ActionName,ActionType,AdaptationCategory,Hazard,Sector,Subsector,PrimaryPurpose,InterventionType,Description,BehavioralChangeTargeted,CoBenefits,EquityAndInclusionConsiderations,GHGReductionPotential,AdaptationEffectiveness,CostInvestmentNeeded,TimelineForImplementation,Dependencies,KeyPerformanceIndicators,Impacts
c40_0001,Building Codes,['mitigation'],,,['stationary_energy'],['all'],['ghg_reduction'],['regulations_and_laws'],"""Building Codes and Standards"" entail the formulation and enforcement of regulations guiding the construction of environmentally responsible buildings. By implementing stringent codes, cities promote energy efficiency, reduce carbon emissions, and enhance resilience to climate change, fostering sustainable urban development.","The targeted behavioral change that the ""Building Codes and Standards"" climate action aims to achieve is the adoption of environmentally responsible construction practices among builders, developers, and homeowners. This includes prioritizing energy-efficient designs, utilizing sustainable materials, and adhering to regulations that reduce carbon emissions in new buildings. By enforcing stringent building codes, the intervention seeks to shift perceptions about the importance of sustainability in construction, ultimately leading to a widespread commitment to building practices that contribute to climate resilience and reduced greenhouse gas emissions.","{'air_quality': 0, 'water_quality': 1, 'habitat': 0, 'cost_of_living': 0, 'housing': -1, 'mobility': 0, 'stakeholder_engagement': 0}","The ""Building Codes and Standards"" climate action promotes equity and inclusion in several ways:

1. **Access to Safe Housing**: By enforcing building codes that prioritize safety and resilience, vulnerable communities benefit from improved housing conditions, reducing their risk of displacement due to climate-related disasters.

2. **Energy Efficiency**: Stricter energy efficiency standards can lower utility costs for low-income households, making housing more affordable and reducing the financial burden on underserved communities.

3. **Health Benefits**: Environmentally responsible buildings often incorporate better ventilation and materials, leading to improved indoor air quality, which is particularly beneficial for communities that may face higher health risks.

4. **Job Creation**: The implementation of new building codes can create job opportunities in construction and retrofitting, providing economic benefits to underserved populations and promoting workforce development.

5. **Community Engagement**: The process of developing and enforcing building codes often involves community input, ensuring that the voices of vulnerable populations are considered in urban planning and development decisions.

6. **Resilience to Climate Change**: By enhancing the resilience of buildings in underserved areas, this action helps protect these communities from the disproportionate impacts of climate change, fostering long-term sustainability and stability. 

Overall, the action integrates equity and inclusion by addressing the specific needs and vulnerabilities of underserved communities while promoting sustainable urban development.","{'stationary_energy': '0-19', 'transportation': None, 'waste': None, 'ippu': None, 'afolu': None}",,medium,5-10 years,"['Government commitment to enforce regulations', 'Availability of technical expertise for code development', 'Public awareness and support for sustainable building practices', 'Collaboration with construction industry stakeholders', 'Access to funding for implementation and compliance', 'Integration with existing urban planning and development policies']","['Percentage reduction in energy consumption in new buildings', 'Percentage of buildings compliant with updated building codes', 'Reduction in greenhouse gas emissions from the building sector', 'Number of buildings certified under green building standards', 'Percentage increase in the use of sustainable building materials', 'Average resilience score of buildings against climate-related hazards', 'Number of training sessions conducted for builders and architects on new codes', 'Public awareness and engagement levels regarding building codes and standards']","['Promotes energy efficiency in construction', 'Reduces greenhouse gas emissions', 'Enhances resilience of buildings to climate change', 'Improves housing conditions for vulnerable communities', 'Lowers utility costs for low-income households', 'Creates job opportunities in construction and retrofitting', 'Involves community input in urban planning', 'Improves indoor air quality']"
c40_0002,Building Codes,['mitigation'],,,['stationary_energy'],['residential_buildings'],['ghg_reduction'],['regulations_and_laws'],"""Building Codes and Standards, Residential Buildings"" entail the formulation and enforcement of regulations guiding the construction of environmentally responsible buildings. By implementing stringent codes, cities promote energy efficiency, reduce carbon emissions, and enhance resilience to climate change, fostering sustainable urban development.","The targeted behavioral change that the climate action ""Building Codes and Standards, Residential Buildings"" aims to achieve is the adoption of energy-efficient construction practices among builders, developers, and homeowners. This includes a shift towards designing and constructing residential buildings that comply with stringent environmental regulations, thereby reducing energy consumption and carbon emissions. By fostering a culture of sustainability in building practices, the intervention encourages stakeholders to prioritize environmentally responsible choices in the construction and renovation of homes, ultimately contributing to sustainable urban development and resilience to climate change.","{'air_quality': 0, 'water_quality': 1, 'habitat': 0, 'cost_of_living': 0, 'housing': -1, 'mobility': 0, 'stakeholder_engagement': 0}","The climate action of implementing ""Building Codes and Standards"" for residential buildings promotes equity and inclusion in several ways:

1. **Access to Safe Housing**: By enforcing building codes that prioritize safety and environmental responsibility, vulnerable communities are ensured access to safe and resilient housing, reducing their risk of displacement due to climate-related events.

2. **Energy Efficiency Benefits**: Stricter energy efficiency standards can lower utility costs for residents, particularly benefiting low-income households that may struggle with high energy bills, thus promoting economic equity.

3. **Healthier Living Environments**: The focus on environmentally responsible construction can lead to healthier living conditions, reducing exposure to pollutants and improving overall public health, which is particularly beneficial for underserved communities that often face higher health risks.

4. **Community Resilience**: By enhancing resilience to climate change, these building codes help protect underserved communities from the adverse effects of climate impacts, ensuring they are not disproportionately affected by climate-related disasters.

5. **Inclusive Development**: The formulation of these codes often involves community input, ensuring that the voices of vulnerable populations are considered in the decision-making process, fostering a sense of ownership and inclusion in urban development initiatives. 

Overall, the action integrates equity and inclusion by addressing the specific needs and vulnerabilities of underserved communities while promoting sustainable urban development.","{'stationary_energy': '80-100', 'transportation': None, 'waste': None, 'ippu': None, 'afolu': None}",,medium,5-10 years,"['Collaboration with local governments to develop and enforce building codes', 'Access to updated research and data on energy efficiency and sustainable materials', 'Training and resources for builders and contractors on new standards', 'Public awareness and support for sustainable building practices', 'Funding and incentives for implementing energy-efficient technologies']","['Energy efficiency improvements', 'Reduction in carbon emissions', 'Number of buildings compliant with codes', 'Percentage of new constructions meeting sustainability standards', 'Reduction in energy consumption per square foot', 'Increase in use of renewable energy sources', 'Cost savings from energy-efficient designs', 'Improvement in indoor air quality', 'Resilience metrics against climate impacts', 'Stakeholder engagement and compliance rates']","['Reduction in GHG emissions from residential buildings', 'Improved energy efficiency leading to lower utility costs for residents', 'Enhanced resilience of communities to climate change impacts', 'Promotion of safe and healthy living environments', 'Increased equity in housing access for vulnerable populations']"
c40_0003,Building Codes,['mitigation'],,,['stationary_energy'],['commercial_and_institutional_buildings_and_facilities'],['ghg_reduction'],['regulations_and_laws'],"""Building Codes and Standards, Commercial Buildings"" entail the formulation and enforcement of regulations guiding the construction of environmentally responsible buildings. By implementing stringent codes, cities promote energy efficiency, reduce carbon emissions, and enhance resilience to climate change, fostering sustainable urban development.","The targeted behavioral shift that the climate action ""Building Codes and Standards, Commercial Buildings"" aims to achieve is the adoption of environmentally responsible construction practices among builders, developers, and architects. This includes prioritizing energy efficiency, utilizing sustainable materials, and adhering to stringent building regulations that reduce carbon emissions and enhance resilience to climate change. By enforcing these codes, the intervention seeks to change perceptions about the importance of sustainable building practices, ultimately leading to a widespread commitment to constructing energy-efficient commercial buildings.","{'air_quality': 0, 'water_quality': 1, 'habitat': 0, 'cost_of_living': 0, 'housing': -1, 'mobility': 0, 'stakeholder_engagement': 0}","The climate action of establishing ""Building Codes and Standards, Commercial Buildings"" promotes equity and inclusion in several ways:

1. **Access to Safe and Healthy Environments**: By enforcing regulations for environmentally responsible buildings, the action ensures that all communities, including vulnerable and underserved populations, have access to safe, healthy, and energy-efficient spaces, reducing health risks associated with poor building conditions.

2. **Economic Opportunities**: The implementation of stringent building codes can create job opportunities in the construction and retrofitting sectors, particularly benefiting local workers from underserved communities who may face barriers to employment.

3. **Resilience to Climate Change**: By enhancing the resilience of buildings to climate impacts, the action helps protect vulnerable communities that are often disproportionately affected by climate-related disasters, ensuring they are better equipped to withstand such events.

4. **Energy Cost Savings**: Energy-efficient buildings can lead to lower utility bills, which is particularly beneficial for low-income households and businesses, helping to alleviate financial burdens and promote economic equity.

5. **Community Engagement**: The formulation of building codes often involves stakeholder engagement, which can include input from underserved communities, ensuring their needs and perspectives are considered in the development of regulations that affect their living and working environments. 

Overall, this climate action integrates equity and inclusion by prioritizing the needs of vulnerable populations, promoting economic opportunities, and enhancing community resilience.","{'stationary_energy': '80-100', 'transportation': None, 'waste': None, 'ippu': None, 'afolu': None}",,medium,5-10 years,"['Collaboration with local governments to develop and enforce building codes', 'Access to updated research and data on energy efficiency and sustainable practices', 'Training and resources for builders and contractors on new standards', 'Public awareness and support for sustainable building practices', 'Funding and incentives for implementing energy-efficient technologies']","['Energy consumption reduction', 'Carbon emissions reduction', 'Percentage of buildings meeting code standards', 'Cost savings from energy efficiency', 'Number of buildings certified under green building standards', 'Improvement in indoor air quality', 'Resilience score against climate impacts', 'Rate of compliance with building codes', 'Reduction in water usage', 'Increase in renewable energy usage in buildings']","['Reduction in greenhouse gas emissions by 80-100% in stationary energy sector', 'Promotion of energy-efficient and environmentally responsible construction practices', 'Improvement in water quality through sustainable building practices', 'Creation of job opportunities in construction and retrofitting sectors', 'Enhanced resilience of buildings to climate change impacts', 'Lower utility bills for low-income households and businesses', 'Increased access to safe and healthy environments for underserved communities']"
c40_0004,Building Codes,['mitigation'],,,['stationary_energy'],['commercial_and_institutional_buildings_and_facilities'],['ghg_reduction'],['regulations_and_laws'],"""Building Codes and Standards, Institutional Buildings"" entail the formulation and enforcement of regulations guiding the construction of environmentally responsible buildings. By implementing stringent codes, cities promote energy efficiency, reduce carbon emissions, and enhance resilience to climate change, fostering sustainable urban development.","The targeted behavioral change that the climate action ""Building Codes and Standards, Institutional Buildings"" aims to achieve is the adoption of energy-efficient construction practices among builders, architects, and developers. This intervention seeks to encourage these stakeholders to prioritize environmentally responsible building designs and materials, thereby reducing carbon emissions and enhancing resilience to climate change. By enforcing regulations and standards, the action promotes a shift towards sustainable urban development, ultimately leading to a broader societal acceptance and implementation of energy-efficient practices in the construction industry.","{'air_quality': 0, 'water_quality': 1, 'habitat': 0, 'cost_of_living': 0, 'housing': -1, 'mobility': 0, 'stakeholder_engagement': 0}","The climate action of implementing ""Building Codes and Standards"" for institutional buildings promotes equity and inclusion in several ways:

1. **Access to Safe and Healthy Environments**: By enforcing regulations for environmentally responsible buildings, the action ensures that all communities, including vulnerable and underserved populations, have access to safe, healthy, and energy-efficient spaces. This is particularly important for low-income neighborhoods that may otherwise be subjected to substandard housing conditions.

2. **Job Creation and Economic Opportunities**: The formulation and enforcement of building codes can lead to job creation in construction and related industries. This can provide economic opportunities for underserved communities, helping to reduce disparities in employment and income.

3. **Resilience to Climate Change**: By enhancing resilience to climate change, the action helps protect vulnerable communities that are often disproportionately affected by climate impacts. Improved building standards can mitigate risks such as flooding and extreme heat, thereby safeguarding the health and well-being of these populations.

4. **Community Engagement**: The process of developing and enforcing building codes often involves community input, ensuring that the voices of underserved populations are heard and considered. This participatory approach fosters a sense of ownership and inclusion in the decision-making process.

5. **Long-term Cost Savings**: Energy-efficient buildings can lead to lower utility bills, which is particularly beneficial for low-income households. By promoting energy efficiency through building codes, the action helps alleviate financial burdens on vulnerable communities.

Overall, the implementation of building codes and standards not only addresses environmental concerns but also actively promotes equity and inclusion by considering the needs and rights of underserved communities.","{'stationary_energy': '80-100', 'transportation': None, 'waste': None, 'ippu': None, 'afolu': None}",,medium,5-10 years,"['Collaboration with local governments to develop and enforce building codes', 'Access to updated research and data on energy efficiency and sustainable building practices', 'Training and resources for builders and contractors on new standards', 'Public awareness and support for sustainable building practices', 'Funding and incentives for implementing energy-efficient technologies in buildings']","['Energy efficiency improvements', 'Reduction in carbon emissions', 'Number of buildings compliant with codes', 'Percentage of new buildings meeting sustainability standards', 'Reduction in energy consumption per square foot', 'Increase in use of renewable energy sources', 'Cost savings from energy efficiency measures', 'Improvement in indoor air quality', 'Resilience metrics against climate impacts', 'Stakeholder engagement and training sessions conducted']","['Reduction of GHG emissions by 80-100% in stationary energy sector', 'Promotion of energy-efficient construction practices', 'Improved access to safe and healthy environments for underserved communities', 'Job creation and economic opportunities in construction', 'Enhanced resilience to climate change for vulnerable populations', 'Community engagement in decision-making processes', 'Long-term cost savings for low-income households through reduced utility bills']"
c40_0005,Building Codes,['mitigation'],,,['stationary_energy'],['manufacturing_industries_and_construction'],['ghg_reduction'],['regulations_and_laws'],"""Building Codes and Standards, Industrial Buildings"" entail the formulation and enforcement of regulations guiding the construction of environmentally responsible buildings. By implementing stringent codes, cities promote energy efficiency, reduce carbon emissions, and enhance resilience to climate change, fostering sustainable urban development.","The targeted behavioral shift that the climate action ""Building Codes and Standards, Industrial Buildings"" aims to achieve is the adoption of energy-efficient construction practices and the prioritization of sustainable building designs among architects, builders, and developers. This shift is encouraged through the enforcement of regulations that mandate environmentally responsible building standards, leading to reduced carbon emissions and enhanced resilience to climate change. Ultimately, the goal is to foster a culture of sustainability in urban development, where stakeholders actively choose to comply with and advocate for energy-efficient building practices.","{'air_quality': 0, 'water_quality': 1, 'habitat': 0, 'cost_of_living': 0, 'housing': -1, 'mobility': 0, 'stakeholder_engagement': 0}","The climate action of establishing ""Building Codes and Standards, Industrial Buildings"" promotes equity and inclusion in several ways:

1. **Access to Safe and Healthy Environments**: By enforcing regulations for environmentally responsible buildings, the action ensures that all communities, including vulnerable and underserved populations, have access to safe, healthy, and energy-efficient living and working environments.

2. **Economic Opportunities**: The implementation of stringent building codes can create job opportunities in construction, retrofitting, and maintenance, particularly benefiting low-income individuals and communities that may face barriers to employment.

3. **Resilience to Climate Change**: By enhancing resilience to climate change, the action helps protect underserved communities that are often disproportionately affected by climate impacts, ensuring they are better equipped to withstand environmental challenges.

4. **Reduction of Energy Burden**: Promoting energy efficiency through building standards can lower utility costs for residents and businesses in vulnerable communities, alleviating the financial strain associated with high energy bills.

5. **Community Engagement**: The formulation of building codes often involves stakeholder engagement, which can include input from underserved communities, ensuring their voices and needs are considered in the development of regulations that affect their environments.

6. **Long-term Sustainability**: By fostering sustainable urban development, the action contributes to the overall well-being of all community members, particularly those in marginalized groups who may face greater risks from environmental degradation. 

Overall, this climate action integrates equity and inclusion by prioritizing the needs and rights of vulnerable communities in the pursuit of sustainable development.","{'stationary_energy': '80-100', 'transportation': None, 'waste': None, 'ippu': None, 'afolu': None}",,medium,5-10 years,"['Collaboration with local governments to develop and enforce building codes', 'Access to updated research and data on energy efficiency and sustainable materials', 'Training and resources for builders and contractors on new standards', 'Public awareness and support for sustainable building practices', 'Funding and incentives for compliance with building codes']","['Energy efficiency improvements', 'Reduction in carbon emissions', 'Number of buildings compliant with codes', 'Percentage of new buildings meeting sustainability standards', 'Reduction in energy consumption per square foot', 'Increase in the use of renewable energy sources', 'Cost savings from energy-efficient designs', 'Improvement in indoor air quality', 'Resilience metrics against climate impacts', 'Stakeholder engagement and compliance rates']","['Reduction of GHG emissions by 80-100% in stationary energy sector', 'Promotion of energy-efficient construction practices', 'Creation of job opportunities in construction and retrofitting', 'Improved access to safe and healthy environments for underserved communities', 'Lower utility costs for residents in vulnerable communities', 'Enhanced resilience to climate change for marginalized groups', 'Increased stakeholder engagement in building code development']"
