ActionID,ActionName,ActionType,AdaptationCategory,Hazard,Sector,Subsector,PrimaryPurpose,InterventionType,Description,BehavioralChangeTargeted,CoBenefits,EquityAndInclusionConsiderations,GHGReductionPotential,AdaptationEffectiveness,CostInvestmentNeeded,TimelineForImplementation,Dependencies,KeyPerformanceIndicators,Impacts
c40_0058,Preparedness,['adaptation'],Educational/Informational actions,['storms'],,,['climate_resilience'],,"""Preparedness"" refers to comprehensive planning and readiness measures to anticipate and respond to the impacts of climate-related events. This strategy ensures that communities are equipped to handle emergencies and enhance overall resilience",,"{'air_quality': 0, 'water_quality': 0, 'habitat': 0, 'cost_of_living': 0, 'housing': 0, 'mobility': 0, 'stakeholder_engagement': 0}","The climate action of ""Preparedness"" promotes equity and inclusion by ensuring that comprehensive planning and readiness measures specifically address the needs of vulnerable or underserved communities. This approach recognizes that these communities often face greater risks from climate-related events due to existing social, economic, and environmental disparities. By prioritizing their unique challenges and incorporating their voices in the planning process, the action fosters a more equitable distribution of resources and support.

Additionally, the emphasis on enhancing overall resilience means that preparedness efforts are designed to empower these communities, providing them with the tools and knowledge necessary to effectively respond to emergencies. This not only helps to mitigate the impacts of climate events but also promotes social cohesion and community engagement, ensuring that all members, particularly those who are most at risk, are included in the decision-making processes that affect their lives.",,high,low,5-10 years,"['Access to accurate climate data and forecasts to inform planning', 'Collaboration among local governments, organizations, and communities for effective response', 'Availability of resources and funding for preparedness initiatives', 'Training and education programs for community members on emergency response', 'Infrastructure resilience to withstand climate-related events', 'Public awareness campaigns to promote preparedness measures']","['Number of communities with updated emergency response plans', 'Percentage of population trained in emergency preparedness', 'Frequency of climate-related drills and simulations conducted', 'Availability of resources and supplies for emergency response', 'Community awareness and engagement levels regarding climate preparedness', 'Time taken to mobilize resources during a climate emergency', 'Number of partnerships established with local organizations for preparedness initiatives', 'Assessment scores of community resilience before and after preparedness measures']","['Enhances community resilience to storms', 'Promotes equity and inclusion for vulnerable communities', 'Empowers communities with knowledge and tools for emergency response', 'Fosters social cohesion and community engagement']"
c40_0059,Early Warning,['adaptation'],Educational/Informational actions,['storms'],,,['climate_resilience'],,"""Early Warning"" systems involve the timely detection and communication of potential climate-related hazards, enabling proactive responses to mitigate risks. This initiative enhances community preparedness and reduces the impact of adverse events.",,"{'air_quality': 0, 'water_quality': 0, 'habitat': 0, 'cost_of_living': 0, 'housing': 0, 'mobility': 0, 'stakeholder_engagement': 0}","The ""Early Warning"" systems initiative promotes equity and inclusion by ensuring that vulnerable or underserved communities receive timely and accessible information about climate-related hazards. By focusing on proactive communication, the action helps to empower these communities, which often lack the resources to prepare for and respond to climate threats. 

Additionally, the initiative can be designed to reach diverse populations, including those with language barriers or disabilities, ensuring that all community members can understand and act on the warnings. This inclusivity helps to reduce disparities in risk and enhances overall community resilience, as everyone is better equipped to respond to potential hazards. 

Overall, the action recognizes the unique challenges faced by underserved communities and aims to provide them with the necessary tools and information to protect themselves from climate impacts, thereby fostering a more equitable approach to climate resilience.",,high,high,5-10 years,"['Access to reliable climate data and forecasting models', 'Effective communication infrastructure for disseminating warnings', 'Community engagement and education on climate risks', 'Collaboration with local and national emergency response agencies', 'Funding and resources for technology and system maintenance']","['Number of early warnings issued', 'Response time to warnings', 'Community awareness and preparedness levels', 'Reduction in disaster-related damages', 'Number of training sessions conducted', 'Stakeholder engagement and participation rates', 'Feedback from community on warning effectiveness', 'Frequency of drills and simulations conducted']","['Enhanced community preparedness for storms', 'Reduced impact of climate-related hazards', 'Empowerment of vulnerable communities', 'Improved equity and inclusion in climate resilience efforts', 'Increased accessibility of information for diverse populations']"
c40_0060,Managed Retreat,['adaptation'],Behavioural actions,['storms'],,,['climate_resilience'],,"""Managed Retreat"" strategies involve planned relocation away from high-risk areas vulnerable to climate change impacts. This adaptation measure aims to protect communities from sea-level rise, flooding, and other environmental risks.",,"{'air_quality': 0, 'water_quality': 0, 'habitat': 0, 'cost_of_living': 0, 'housing': 0, 'mobility': 0, 'stakeholder_engagement': 0}","The ""Managed Retreat"" strategies inherently promote equity and inclusion by prioritizing the safety and well-being of vulnerable or underserved communities that are most at risk from climate change impacts. By focusing on planned relocation, these strategies aim to protect marginalized populations who often lack the resources to adapt to environmental changes on their own. 

Additionally, the implementation of managed retreat involves engaging affected communities in the decision-making process, ensuring that their voices and needs are considered. This participatory approach helps to address historical inequities and empowers residents to have a say in their future. 

Furthermore, managed retreat can provide opportunities for equitable access to safer housing and infrastructure, reducing the disproportionate burden of climate risks faced by low-income and marginalized groups. Overall, this climate action recognizes and addresses the unique challenges faced by underserved communities, fostering a more inclusive approach to climate adaptation.",,medium,high,<5 years,"['Assessment of high-risk areas to identify communities that need relocation', 'Availability of funding and resources to support relocation efforts', 'Community engagement and support for relocation plans', 'Development of new infrastructure in safer areas', 'Policy and regulatory frameworks that facilitate managed retreat', 'Coordination among government agencies and stakeholders involved in the relocation process']","['Number of communities successfully relocated', 'Reduction in population exposure to high-risk areas', 'Percentage of affected residents engaged in the planning process', 'Cost-effectiveness of relocation strategies', 'Improvement in community resilience metrics', 'Time taken to implement relocation plans', 'Satisfaction levels of relocated residents', 'Environmental impact assessments post-relocation']","['Enhances climate resilience for vulnerable communities', 'Promotes equity and inclusion through community engagement', 'Addresses historical inequities in climate adaptation', 'Provides safer housing and infrastructure options', 'Reduces risks associated with storms for marginalized populations']"
c40_0061,Non-Potable Water,['adaptation'],Behavioural actions,,,,['climate_resilience'],,"""Non-Potable Water"" initiatives involve the use of treated or untreated water for non-drinking purposes such as irrigation, industrial processes, or flushing. This water conservation strategy reduces the demand on potable water sources and promotes sustainable water management.",,"{'air_quality': 0, 'water_quality': 0, 'habitat': 0, 'cost_of_living': 0, 'housing': 0, 'mobility': 0, 'stakeholder_engagement': 0}","The ""Non-Potable Water"" initiatives promote equity and inclusion by ensuring that underserved communities have access to alternative water sources for non-drinking purposes. This is particularly beneficial in areas where potable water is scarce or expensive, allowing these communities to utilize treated or untreated water for essential activities like irrigation and sanitation. 

By reducing the demand on potable water sources, the initiative helps to alleviate the burden on vulnerable populations who may struggle with water access, thereby promoting sustainable water management practices that are inclusive of all community members. Additionally, these initiatives can create opportunities for local engagement and participation in water management decisions, empowering underserved communities to take an active role in their resource management. Overall, the action addresses the needs of vulnerable populations by providing them with viable solutions for water use, fostering a more equitable distribution of water resources.",,,low,<5 years,"['Availability of infrastructure for water treatment and distribution', 'Regulatory frameworks supporting the use of non-potable water', 'Public awareness and acceptance of non-potable water usage', 'Technological advancements in water treatment processes', 'Collaboration between government, industry, and community stakeholders']","['Volume of non-potable water used', 'Percentage reduction in potable water consumption', 'Number of non-potable water projects implemented', 'Water quality metrics of treated non-potable water', 'Cost savings from reduced potable water use', 'Public awareness and engagement levels', 'Reduction in wastewater discharge', 'Impact on local ecosystems']","['Promotes sustainable water management', 'Enhances access to water for underserved communities', 'Reduces demand on potable water sources', 'Empowers local communities in water management decisions', 'Addresses needs of vulnerable populations']"
c40_0062,Water Tariffs,['adaptation'],Economic actions,['droughts'],,,['climate_resilience'],,"""Water Tariffs"" involve pricing structures for water use, encouraging conservation and efficient use of water resources. This initiative aims to promote responsible water consumption and contribute to sustainable water management.",,"{'air_quality': 0, 'water_quality': 1, 'habitat': 0, 'cost_of_living': 0, 'housing': 0, 'mobility': 0, 'stakeholder_engagement': 0}","The ""Water Tariffs"" initiative promotes equity and inclusion by implementing pricing structures that can be designed to protect vulnerable and underserved communities. By encouraging responsible water consumption, the initiative can help ensure that all community members, regardless of their economic status, have access to essential water resources. 

Additionally, tiered pricing models can be established, where lower rates are applied to basic water needs, ensuring that low-income households are not disproportionately burdened by costs. This approach can help prevent water insecurity among underserved populations, fostering a more equitable distribution of water resources.

Furthermore, the initiative can include educational components aimed at raising awareness in vulnerable communities about water conservation practices, empowering them to make informed decisions about their water use. Overall, the ""Water Tariffs"" action considers the needs of underserved communities by promoting sustainable water management while ensuring access and affordability.",,high,low,5-10 years,"['Effective monitoring and measurement of water usage to inform tariff structures', 'Public awareness and education on the importance of water conservation', 'Support from local governments and regulatory bodies to implement and enforce tariffs', 'Availability of alternative water sources to reduce dependency on traditional supply', 'Technological infrastructure for billing and tracking water consumption']","['Water consumption reduction percentage', 'Percentage of users adopting conservation practices', 'Revenue generated from water tariffs', 'Change in water usage per capita', 'Customer satisfaction with water pricing', 'Rate of water loss in distribution system', 'Percentage of households using water-efficient appliances', 'Impact on local water resources sustainability']","['Promotes responsible water consumption', 'Enhances climate resilience against droughts', 'Improves water quality', 'Supports equity and inclusion for vulnerable communities', 'Encourages sustainable water management practices']"
c40_0063,Local Food Support,['adaptation'],Economic actions,,,,['climate_resilience'],,"""Local Food Support"" programs promote the production and consumption of locally sourced foods. This initiative enhances food security, reduces the carbon footprint associated with food transportation, and supports local agricultural economies.",,"{'air_quality': 0, 'water_quality': 0, 'habitat': 0, 'cost_of_living': 1, 'housing': 0, 'mobility': 0, 'stakeholder_engagement': 0}","The ""Local Food Support"" programs promote equity and inclusion by directly addressing the needs of vulnerable and underserved communities in several ways:

1. **Food Security**: By enhancing access to locally sourced foods, these programs help ensure that low-income families and marginalized groups have reliable access to nutritious food, thereby addressing food insecurity.

2. **Economic Support**: The initiative supports local agricultural economies, which often include small-scale farmers from underserved communities. This creates economic opportunities and helps to uplift these communities.

3. **Reduced Transportation Barriers**: By focusing on local food production and consumption, the program reduces the reliance on long-distance food transportation, which can disproportionately affect low-income communities that may lack access to transportation.

4. **Cultural Relevance**: Local food initiatives can incorporate culturally significant foods, ensuring that diverse communities see their dietary preferences and traditions represented, fostering a sense of inclusion.

5. **Community Engagement**: These programs often involve community participation in decision-making processes, empowering underserved populations to have a voice in the food systems that affect them.

Overall, the ""Local Food Support"" programs are designed to create a more equitable food system that prioritizes the needs and contributions of vulnerable communities.",,,medium,<5 years,"['Availability of local agricultural resources and farmers', 'Community engagement and support for local food initiatives', 'Infrastructure for distribution and storage of local foods', 'Consumer awareness and education about the benefits of local foods', 'Policies and regulations that support local food systems']","['Increase in local food production', 'Reduction in food transportation emissions', 'Growth in local agricultural economy', 'Increase in community participation in local food programs', 'Improvement in food security metrics', 'Percentage of locally sourced food in local markets', 'Consumer awareness and education levels regarding local food benefits']","['Enhances food security for low-income families', 'Supports local agricultural economies', 'Reduces carbon footprint from food transportation', 'Promotes equity and inclusion for underserved communities', 'Empowers community participation in food systems']"
c40_0064,Market Access,['adaptation'],Economic actions,,,,['climate_resilience'],,"""Market Access"" initiatives aim to remove barriers that hinder farmers' access to markets, promoting equitable opportunities for agricultural producers. This strategy enhances food security, fosters economic development, and supports sustainable food systems.",,"{'air_quality': 0, 'water_quality': 0, 'habitat': 0, 'cost_of_living': 0, 'housing': 0, 'mobility': 0, 'stakeholder_engagement': 0}","The ""Market Access"" initiatives promote equity and inclusion by specifically targeting barriers that disproportionately affect vulnerable or underserved farmers, such as smallholder and marginalized producers. By facilitating access to markets, these initiatives ensure that all agricultural producers, regardless of their socio-economic status, have equitable opportunities to sell their products. This approach not only enhances food security for these communities but also fosters economic development by enabling them to participate in and benefit from sustainable food systems. Additionally, by focusing on underserved populations, the action actively works to uplift those who have historically been excluded from market opportunities, thereby promoting social and economic equity.",,,low,<5 years,"['Access to infrastructure such as roads and transportation to facilitate market connectivity', 'Availability of information and resources for farmers to understand market demands and pricing', 'Supportive policies and regulations that promote fair trade and market access', 'Financial services and credit options for farmers to invest in production and marketing', 'Collaboration with local and international organizations to enhance market opportunities']","['Number of farmers accessing new markets', 'Percentage increase in farmer income', 'Volume of agricultural products sold', 'Number of market barriers identified and addressed', 'Percentage of farmers reporting improved market access', 'Increase in local food production', 'Number of partnerships established with market stakeholders', 'Percentage of sustainable practices adopted by farmers']","['Enhances food security for vulnerable farmers', 'Promotes economic development for marginalized producers', 'Facilitates equitable market access for smallholder farmers', 'Supports social and economic equity in agricultural systems']"
c40_0065,Food Access Laws,['adaptation'],Laws and regulations actions,,,,['climate_resilience'],,"""Food Access Laws"" involve legislation and policies that ensure equitable access to healthy and affordable food options. This initiative addresses food justice issues and promotes community well-being through improved food access.",,"{'air_quality': 0, 'water_quality': 0, 'habitat': 0, 'cost_of_living': 0, 'housing': 0, 'mobility': 0, 'stakeholder_engagement': 0}","The ""Food Access Laws"" initiative promotes equity and inclusion by specifically targeting vulnerable and underserved communities that often face barriers to accessing healthy and affordable food. By addressing food justice issues, the legislation seeks to rectify systemic inequalities that disproportionately affect low-income populations and marginalized groups. 

Additionally, the initiative fosters community well-being by ensuring that all individuals, regardless of their socioeconomic status, have the opportunity to access nutritious food options. This approach not only enhances food security but also empowers communities to participate in decision-making processes related to food access, thereby promoting inclusivity and representation. Overall, the action recognizes and addresses the unique challenges faced by underserved communities, ensuring that their needs are prioritized in the pursuit of equitable food access.",,,low,<5 years,"['Support from local and state governments to enact and enforce food access laws', 'Collaboration with community organizations to identify food justice issues', 'Funding and resources for implementing food access initiatives', 'Public awareness campaigns to educate communities about food access rights', 'Partnerships with local farmers and food producers to ensure a diverse supply of healthy food options']","['Number of food access laws enacted', 'Percentage increase in access to healthy food options', 'Reduction in food insecurity rates', 'Number of community organizations involved in food access initiatives', 'Percentage of low-income households with access to affordable healthy food', 'Increase in local food production', 'Public awareness and engagement levels regarding food justice issues', 'Changes in health outcomes related to diet and nutrition']","['Promotes equitable access to healthy and affordable food', 'Addresses food justice issues', 'Enhances food security for vulnerable communities', 'Empowers underserved communities in decision-making', 'Improves community well-being']"
c40_0066,Efficiency Rules,['adaptation'],Laws and regulations actions,['droughts'],,,['climate_resilience'],,"""Efficiency Rules"" encompass regulations and standards aimed at improving resource use and reducing waste in various sectors. This initiative contributes to overall resource efficiency, environmental sustainability, and climate mitigation.",,"{'air_quality': 0, 'water_quality': 1, 'habitat': 0, 'cost_of_living': 0, 'housing': 0, 'mobility': 0, 'stakeholder_engagement': 0}","The ""Efficiency Rules"" initiative promotes equity and inclusion by ensuring that regulations and standards for resource use and waste reduction are applied uniformly across all sectors, including those that serve vulnerable or underserved communities. By improving resource efficiency, the initiative helps to lower costs for essential services, making them more accessible to low-income households. Additionally, the focus on environmental sustainability directly benefits communities that are often disproportionately affected by pollution and resource depletion, thereby addressing historical inequities. Furthermore, the initiative can create job opportunities in sectors focused on efficiency improvements, providing economic benefits to underserved populations. Overall, the ""Efficiency Rules"" contribute to a more equitable distribution of environmental benefits and resources, fostering inclusion in climate action efforts.",,medium,low,5-10 years,"['Regulatory frameworks that support the implementation of efficiency standards', 'Technological advancements that enable improved resource use', 'Stakeholder engagement and collaboration across sectors', 'Data collection and analysis for monitoring resource efficiency', 'Public awareness and education on sustainability practices']","['Resource use efficiency', 'Waste reduction percentage', 'Carbon emissions reduction', 'Energy consumption per unit of output', 'Water usage efficiency', 'Percentage of recycled materials used', 'Compliance rate with efficiency standards', 'Cost savings from efficiency improvements', 'Public awareness and engagement levels', 'Reduction in environmental impact assessments']","['Improved water quality', 'Enhanced climate resilience', 'Promotion of equity and inclusion', 'Economic benefits through job creation', 'Reduction of resource waste']"
