ActionID,ActionName,ActionType,AdaptationCategory,Hazard,Sector,Subsector,PrimaryPurpose,InterventionType,Description,BehavioralChangeTargeted,CoBenefits,EquityAndInclusionConsiderations,GHGReductionPotential,AdaptationEffectiveness,CostInvestmentNeeded,TimelineForImplementation,Dependencies,KeyPerformanceIndicators,Impacts
c40_0024,Ferry Emissions,['mitigation'],,,['transportation'],['waterborne_navigation'],['ghg_reduction'],"['regulations_and_laws', 'programs_and_initiatives']","""Ferry Emissions"" reduction strategies aim to decrease the environmental footprint of water-based transportation. Implementing cleaner fuels and emission control technologies enhances the sustainability of ferry operations, preserving marine ecosystems.","The targeted behavioral change that the ""Ferry Emissions"" reduction strategies aim to achieve is the increased adoption of environmentally sustainable transportation practices among ferry operators and users. This includes encouraging ferry operators to implement cleaner fuels and emission control technologies, while also influencing passengers to prefer ferries that prioritize sustainability. Ultimately, the goal is to shift public perception towards valuing and choosing low-emission transportation options, thereby contributing to the preservation of marine ecosystems and reducing overall greenhouse gas emissions from water-based transportation.","{'air_quality': 1, 'water_quality': 1, 'habitat': 0, 'cost_of_living': 0, 'housing': 0, 'mobility': 0, 'stakeholder_engagement': 0}","The ""Ferry Emissions"" reduction strategies promote equity and inclusion by prioritizing the health and well-being of vulnerable or underserved communities that rely on ferry services for transportation. By implementing cleaner fuels and emission control technologies, the action directly addresses air quality issues that disproportionately affect low-income neighborhoods and communities of color located near ferry routes. 

Additionally, enhancing the sustainability of ferry operations helps ensure that these communities have access to reliable and environmentally friendly transportation options, which can improve mobility and economic opportunities. The focus on preserving marine ecosystems also benefits these communities, as they often depend on healthy waterways for fishing, recreation, and tourism, thereby supporting their livelihoods and cultural practices. Overall, the action recognizes and addresses the specific needs of underserved populations, fostering a more equitable transportation system.","{'stationary_energy': None, 'transportation': '20-39', 'waste': None, 'ippu': None, 'afolu': None}",,medium,5-10 years,"['Availability of cleaner fuel alternatives for ferry operations', 'Development and implementation of emission control technologies', 'Regulatory frameworks supporting emissions reduction', 'Investment in infrastructure for cleaner fuel distribution', 'Collaboration with ferry operators and stakeholders for adoption of sustainable practices', 'Research and development for innovative solutions in marine transportation']","['Reduction in CO2 emissions (tons)', 'Percentage of ferries using cleaner fuels', 'Reduction in particulate matter emissions (tons)', 'Number of ferries equipped with emission control technologies', 'Fuel consumption per passenger mile', 'Percentage decrease in overall ferry emissions', 'Compliance rate with environmental regulations', 'Marine ecosystem health indicators']","['Reduction of greenhouse gas emissions from waterborne transportation by 20-39%', 'Improvement in air quality benefiting vulnerable communities', 'Enhancement of water quality through reduced pollution from ferry operations', 'Promotion of sustainable transportation practices among ferry operators and users', 'Support for economic opportunities in underserved communities reliant on ferry services']"
c40_0025,Truck Emissions,['mitigation'],,,['transportation'],['on-road'],['ghg_reduction'],"['programs_and_initiatives', 'incentives_and_subsidies']","""Truck Emissions"" mitigation involves adopting cleaner fuels and technologies to reduce the environmental impact of freight transportation. This initiative aims to decrease air pollution, promote sustainability, and improve the overall efficiency of urban logistics.","The targeted behavioral change that the ""Truck Emissions"" mitigation initiative aims to achieve is the adoption of cleaner fuels and technologies by freight transportation companies. This shift encourages these companies to prioritize sustainability and efficiency in their logistics operations, ultimately leading to a reduction in air pollution and greenhouse gas emissions associated with freight transport. By implementing financial incentives and supportive programs, the initiative seeks to influence the perceptions of these companies regarding the benefits of cleaner technologies, fostering a broader transition towards environmentally friendly practices in urban logistics.","{'air_quality': 1, 'water_quality': 0, 'habitat': 0, 'cost_of_living': 0, 'housing': 0, 'mobility': 0, 'stakeholder_engagement': 0}","The ""Truck Emissions"" mitigation initiative promotes equity and inclusion by addressing the disproportionate impact of air pollution on vulnerable and underserved communities, often located near freight corridors. By adopting cleaner fuels and technologies, the action directly benefits these communities by improving air quality, which is crucial for public health, particularly for low-income populations and communities of color that may have limited access to healthcare resources. 

Additionally, the initiative enhances sustainability and urban logistics efficiency, which can lead to economic opportunities and job creation in these underserved areas. By prioritizing cleaner transportation methods, the action supports a more equitable distribution of environmental benefits, ensuring that marginalized communities are not left behind in the transition to a greener economy. Overall, the focus on reducing emissions aligns with the goal of fostering healthier, more resilient communities that are often the most affected by environmental degradation.","{'stationary_energy': None, 'transportation': '20-39', 'waste': None, 'ippu': None, 'afolu': None}",,medium,<5 years,"['Availability of cleaner fuel alternatives', 'Development and adoption of advanced emission-reducing technologies', 'Supportive regulatory frameworks and policies', 'Investment in infrastructure for cleaner freight options', 'Collaboration between stakeholders in the logistics and transportation sectors']","['Reduction in CO2 emissions (tons)', 'Percentage of trucks using cleaner fuels', 'Improvement in fuel efficiency (miles per gallon)', 'Reduction in particulate matter emissions (PM2.5)', 'Increase in the number of electric or hybrid trucks', 'Cost savings from fuel efficiency improvements', 'Percentage decrease in urban air pollution levels', 'Number of logistics companies adopting sustainable practices']","['Reduction in greenhouse gas emissions by 20-39% in the transportation sector', 'Improvement in air quality benefiting vulnerable communities', 'Promotion of cleaner fuels and technologies in freight transportation', 'Encouragement of sustainable practices in urban logistics', 'Potential economic opportunities and job creation in underserved areas']"
c40_0026,Vehicle Emissions,['mitigation'],,,['transportation'],['on-road'],['ghg_reduction'],"['incentives_and_subsidies', 'regulations_and_laws', 'programs_and_initiatives']","""Vehicle Emissions"" reduction strategies focus on minimizing the environmental impact of all types of vehicles. Implementing cleaner technologies and promoting alternative fuels contribute to lower emissions, fostering sustainable and eco-friendly transportation.","The targeted behavioral shift that the ""Vehicle Emissions"" reduction strategies aim to achieve is the increased adoption of cleaner transportation options, such as electric vehicles and alternative fuel vehicles, as well as a greater reliance on public transportation, biking, and walking. This shift is encouraged through financial incentives, regulations mandating lower emissions, and programs promoting sustainable transportation practices, ultimately leading to a significant reduction in greenhouse gas emissions from the transportation sector.","{'air_quality': 1, 'water_quality': 0, 'habitat': 0, 'cost_of_living': 0, 'housing': 0, 'mobility': 0, 'stakeholder_engagement': 0}","The ""Vehicle Emissions"" reduction strategies inherently promote equity and inclusion by addressing the environmental impacts that disproportionately affect vulnerable and underserved communities. These communities often experience higher levels of air pollution and related health issues due to proximity to high-traffic areas and industrial zones. By implementing cleaner technologies and promoting alternative fuels, the action directly benefits these populations by improving air quality and reducing health risks.

Additionally, the focus on sustainable and eco-friendly transportation can enhance access to affordable and efficient transportation options for underserved communities, which may lack reliable public transit. This inclusivity ensures that all community members, regardless of socioeconomic status, can benefit from cleaner air and improved public health outcomes. Overall, the action recognizes and addresses the specific needs of vulnerable populations, fostering a more equitable approach to climate action.","{'stationary_energy': None, 'transportation': '80-100', 'waste': None, 'ippu': None, 'afolu': None}",,medium,<5 years,"['Development and availability of cleaner vehicle technologies', 'Infrastructure for alternative fuel distribution', 'Government policies and regulations supporting emissions reduction', 'Public awareness and acceptance of eco-friendly transportation options', 'Investment in research and development for sustainable transportation solutions']","['Reduction in vehicle emissions (CO2, NOx, PM)', 'Percentage of vehicles using alternative fuels', 'Number of electric vehicles on the road', 'Fuel efficiency improvements (miles per gallon)', 'Adoption rate of cleaner technologies', 'Reduction in fossil fuel consumption', 'Public transportation usage rates', 'Air quality index improvements', 'Percentage of low-emission zones established', 'Investment in sustainable transportation infrastructure']","['Significant reduction in greenhouse gas emissions from the transportation sector', 'Improved air quality benefiting vulnerable and underserved communities', 'Increased adoption of cleaner transportation options', 'Enhanced access to affordable and efficient transportation for underserved populations']"
c40_0027,Rail Improvements,['mitigation'],,,['transportation'],['railways'],['ghg_reduction'],"['infrastructure_investments', 'programs_and_initiatives']","""Rail Improvements"" involve enhancing the efficiency and sustainability of railway systems. By investing in modernization and eco-friendly practices, cities aim to promote rail as a low-emission and energy-efficient mode of transportation.","The targeted behavioral change that the ""Rail Improvements"" climate action aims to achieve is an increased reliance on rail transportation as a primary mode of travel, leading to a reduction in the use of personal vehicles. This shift is encouraged by enhancing the efficiency, safety, and convenience of rail systems, thereby changing public perceptions about rail travel and promoting it as a low-emission, energy-efficient alternative. Ultimately, this behavioral change contributes to a broader activity shift towards sustainable transportation practices, reducing greenhouse gas emissions in urban areas.","{'air_quality': 1, 'water_quality': 0, 'habitat': 0, 'cost_of_living': 0, 'housing': 0, 'mobility': 0, 'stakeholder_engagement': 0}","The ""Rail Improvements"" climate action promotes equity and inclusion in several ways:

1. **Accessibility for Underserved Communities**: By enhancing railway systems, the action aims to provide better access to public transportation for vulnerable populations, including low-income individuals and communities that may lack reliable transportation options.

2. **Affordable Transportation**: Modernized and efficient rail systems can lead to lower operational costs, which may translate into more affordable fares for riders, benefiting those who are economically disadvantaged.

3. **Job Creation**: The investment in rail improvements can create job opportunities in construction, maintenance, and operation, particularly benefiting local communities that may face higher unemployment rates.

4. **Reduced Environmental Impact**: By promoting low-emission rail transport, the action addresses environmental justice concerns, as underserved communities often bear the brunt of pollution and climate change impacts.

5. **Community Engagement**: The planning and implementation of rail improvements can involve input from local communities, ensuring that the needs and preferences of diverse populations are considered in the development process.

6. **Health Benefits**: Improved rail systems can lead to reduced air pollution and traffic congestion, contributing to better health outcomes for vulnerable communities that are disproportionately affected by environmental hazards. 

Overall, the ""Rail Improvements"" initiative is designed to enhance transportation equity and support the inclusion of underserved communities in sustainable development efforts.","{'stationary_energy': None, 'transportation': '40-59', 'waste': None, 'ippu': None, 'afolu': None}",,high,5-10 years,"['Investment in infrastructure and technology for rail systems', 'Government policies and regulations supporting sustainable transportation', 'Public and private partnerships for funding and implementation', 'Community support and public awareness of rail benefits', 'Availability of eco-friendly materials and practices for modernization']","['Reduction in greenhouse gas emissions from rail transport', 'Increase in rail ridership', 'Percentage of trains using renewable energy sources', 'Improvement in energy efficiency of rail systems', 'Reduction in travel time for rail passengers', 'Increase in freight transported by rail', 'Customer satisfaction ratings for rail services', 'Investment in rail infrastructure improvements', 'Reduction in maintenance costs for rail systems', 'Percentage of rail network electrified']","['Reduction in greenhouse gas emissions from transportation by 40-59%', 'Improved air quality due to decreased reliance on personal vehicles', 'Enhanced accessibility to public transportation for underserved communities', 'Creation of job opportunities in rail construction and maintenance', 'Lower operational costs leading to more affordable fares for riders', 'Health benefits from reduced air pollution and traffic congestion', 'Increased community engagement in transportation planning']"
c40_0028,Zero Emission Buses,['mitigation'],,,['transportation'],['on-road'],['ghg_reduction'],"['programs_and_initiatives', 'infrastructure_investments']","""Zero Emission Buses"" initiatives focus on integrating electric or other zero-emission technologies into public transportation fleets. This strategy aims to eliminate traditional bus emissions, contributing to cleaner air and a more sustainable urban transit system.","The targeted behavioral shift that the ""Zero Emission Buses"" initiative aims to achieve is an increased reliance on public transportation, specifically the use of electric or zero-emission buses, over personal vehicles. This shift is intended to encourage individuals to choose cleaner, more sustainable transit options, thereby reducing greenhouse gas emissions and contributing to improved air quality in urban areas. By enhancing the perception of public transportation as a convenient, safe, and environmentally friendly alternative, the initiative seeks to foster a cultural norm that prioritizes sustainable commuting practices.","{'air_quality': 2, 'water_quality': 0, 'habitat': 0, 'cost_of_living': 0, 'housing': 0, 'mobility': 0, 'stakeholder_engagement': 0}","The ""Zero Emission Buses"" initiative promotes equity and inclusion by prioritizing cleaner air in urban areas, which often include vulnerable or underserved communities that are disproportionately affected by air pollution. By transitioning to electric or zero-emission buses, the initiative directly addresses health disparities faced by these populations, improving their overall quality of life.

Additionally, the integration of zero-emission technologies into public transportation enhances accessibility to reliable and sustainable transit options for low-income individuals who may rely on public transport for their daily commutes. This ensures that all community members, regardless of socioeconomic status, have equitable access to clean transportation.

Furthermore, the initiative may create job opportunities in the maintenance and operation of zero-emission buses, particularly in communities that have historically faced economic disadvantages. This can help foster economic inclusion and support local workforce development.

Overall, the initiative's focus on reducing emissions and improving public transportation aligns with the needs of underserved communities, promoting environmental justice and equitable access to clean transit solutions.","{'stationary_energy': None, 'transportation': '20-39', 'waste': None, 'ippu': None, 'afolu': None}",,high,<5 years,"['Availability of electric or zero-emission bus technology', 'Investment in charging infrastructure for electric buses', 'Supportive government policies and regulations promoting zero-emission transportation', 'Public funding or financial incentives for transit agencies', 'Training and workforce development for maintenance and operation of new technologies', 'Public acceptance and demand for cleaner public transportation options']","['Number of zero-emission buses deployed', 'Reduction in greenhouse gas emissions', 'Percentage of public transportation fleet that is zero-emission', 'Air quality improvement metrics', 'Operational cost savings from zero-emission buses', 'Public ridership levels', 'Energy consumption per mile', 'Maintenance costs of zero-emission buses', 'User satisfaction ratings', 'Reduction in noise pollution']","['Reduction of greenhouse gas emissions in the transportation sector by 20-39%', 'Improvement of air quality in urban areas', 'Promotion of equity and inclusion for underserved communities', 'Enhanced accessibility to public transportation for low-income individuals', 'Creation of job opportunities in the maintenance and operation of zero-emission buses']"
c40_0029,EV Fleet,['mitigation'],,,['transportation'],['on-road'],['ghg_reduction'],"['programs_and_initiatives', 'infrastructure_investments']","""EV Fleet"" initiatives involve transitioning municipal vehicle fleets to electric vehicles (EVs). By embracing electric transportation, cities reduce emissions, lower air pollution, and contribute to the overall adoption of sustainable and eco-friendly mobility solutions.","The targeted behavioral change that the ""EV Fleet"" initiative aims to achieve is the increased adoption and use of electric vehicles (EVs) among municipal fleets and, by extension, the general public. This shift is expected to result in a broader acceptance of electric transportation as a viable and sustainable mobility option, leading to reduced greenhouse gas emissions and lower air pollution. By enhancing the perception of EVs as convenient, environmentally friendly, and socially desirable, the initiative encourages individuals and organizations to transition away from traditional fossil fuel-powered vehicles, ultimately contributing to a significant activity shift towards sustainable transportation practices.","{'air_quality': 1, 'water_quality': 0, 'habitat': 0, 'cost_of_living': 0, 'housing': 0, 'mobility': 0, 'stakeholder_engagement': 0}","The ""EV Fleet"" initiatives promote equity and inclusion in several ways:

1. **Improved Air Quality**: By reducing emissions and lowering air pollution, these initiatives directly benefit vulnerable and underserved communities that are often located near high-traffic areas and are disproportionately affected by poor air quality.

2. **Access to Clean Transportation**: Transitioning to electric vehicles can enhance access to cleaner transportation options for all community members, including those in low-income neighborhoods who may rely on municipal services for mobility.

3. **Job Creation and Economic Opportunities**: The implementation of EV fleets can create job opportunities in the maintenance, operation, and infrastructure development of electric vehicles, providing economic benefits to underserved populations.

4. **Community Engagement**: These initiatives often involve community input and engagement, ensuring that the voices of marginalized groups are heard and considered in the planning and execution of transportation solutions.

5. **Long-term Cost Savings**: By investing in electric vehicles, municipalities can reduce operational costs over time, potentially allowing for reinvestment in community services that benefit low-income residents.

Overall, the ""EV Fleet"" initiatives are designed to address environmental justice by prioritizing the health and economic well-being of vulnerable communities while promoting sustainable transportation solutions.","{'stationary_energy': None, 'transportation': '0-19', 'waste': None, 'ippu': None, 'afolu': None}",,high,5-10 years,"['Availability of charging infrastructure for electric vehicles', 'Access to funding and financial incentives for purchasing EVs', 'Support from local government and policy frameworks promoting EV adoption', 'Public awareness and acceptance of electric vehicles', 'Availability of a reliable supply chain for EVs and related components', 'Training and resources for municipal staff on EV maintenance and operation']","['Number of electric vehicles in the fleet', 'Reduction in greenhouse gas emissions', 'Decrease in air pollution levels', 'Cost savings on fuel and maintenance', 'Percentage of fleet transitioned to electric', 'Increase in public awareness and acceptance of EVs', 'Reduction in fossil fuel consumption', 'Miles driven by electric vehicles', 'Charging infrastructure availability', 'Operational efficiency improvements']","['Reduction in greenhouse gas emissions from transportation', 'Improvement in air quality benefiting vulnerable communities', 'Increased adoption of electric vehicles among municipal fleets and the public', 'Job creation and economic opportunities in EV maintenance and infrastructure', 'Enhanced community engagement in transportation planning', 'Long-term cost savings for municipalities leading to reinvestment in community services']"
c40_0030,EV Charging,['mitigation'],,,['transportation'],,['ghg_reduction'],,,,"{'air_quality': None, 'water_quality': None, 'habitat': None, 'cost_of_living': None, 'housing': None, 'mobility': None, 'stakeholder_engagement': 0}",,,,,,[],[],[]
