"action_id","action_name","action_type","description","action_category","action_subcategory","investment_cost","implementation_timeline","biome"
icare_0165,Develop an Environmental Education Plan,adaptation,"Design and implement a comprehensive environmental education plan that fosters climate literacy and awareness across schools, communities, and the media. Municipal governments can organize workshops, awareness campaigns, and nature-based activities such as tree planting to reconnect residents with their environment. The plan should integrate themes of climate change, adaptation, mitigation, and climate justice, with particular attention to youth, women, and vulnerable groups. By embedding equity and inclusion, cities can strengthen long-term engagement and empower communities to take part in climate action.","Policies, Plans & Programs",Strategic Plans,low,<5 years,
icare_0169,Establish a Plan for Preparation and Emergency Response Measures in the event of extreme weather events,adaptation,"This action focuses on preparing the municipality to respond to extreme events, aiming to provide a rapid response that minimizes the impacts on the population.","Policies, Plans & Programs",Strategic Plans,high,"5-10 years",coastal_marine
icare_0170,Build safe housing and implement urban rehabilitation projects for populations living in high-risk areas,adaptation,"The priority of this action is to build safe housing and implement urban rehabilitation projects for the population living in areas prone to landslides and flooding, as the housing deficit is one of the main factors related to these threats. This will be implemented through the construction of new housing units in safe locations for family resettlement, and infrastructure upgrades like slope stabilization and improved drainage systems within vulnerable communities.",Projects & Physical Actions,Infrastructure Development,high,>10 years,
icare_0171,"Improve the hydrometeorological forecasting, monitoring, and alert system for climate risks",adaptation,"This action aims to expand the procedures related to the existing climate risk forecasting, monitoring, and alert system in the municipality.","Data, Tools & Planning Projects",Tech Pilots & Deployments,medium,"5-10 years",
icare_0172,Develop and implement the Municipal Risk Reduction Plan (PMRR) and identify population groups vulnerable to climate risks.,adaptation,"This action aims to strengthen the development of the Municipal Risk Reduction Plan (PMRR) in the municipality, as it is a highly relevant tool for managing climate risks, especially river floods and landslides.","Policies, Plans & Programs",Strategic Plans,low,<5 years,
icare_0173,Preventive maintenance of drainage systems,adaptation,"Regular upkeep and cleaning of urban drainage systems, including storm drains, sewers, and retention basins, to ensure efficient water flow and prevent blockages that can lead to flooding during heavy rainfall events.",Projects & Physical Actions,Infrastructure Development,medium,"5-10 years",
icare_0176,Develop a Climate Action Plan,adaptation,"A comprehensive plan outlining a city's strategies and actions to mitigate greenhouse gas emissions and adapt to the impacts of climate change which typically includes an assessment of the city's climate risks and vulnerabilities, setting emission reduction targets, and implementation of actions across various sectors such as energy, transportation, waste management, and urban planning.","Policies, Plans & Programs",Strategic Plans,low,<5 years,
icare_0178,Redirect urban development through climate‑risk spatial planning,adaptation,"Mapping of critical flood-prone areas with the aim of revising and harmonizing legislation related to land use, given the intensification of the impacts of extreme weather events.","Policies, Plans & Programs",Strategic Plans,low,<5 years,
icare_0180,Expand urban green-blue networks and corridors,adaptation,"Expand and connect urban green spaces and blue-green infrastructure (BGI) in the public realm. Actions include street tree planting, establishing green corridors/greenways, pocket and large parks, and green-blue features (bioswales, rain gardens, permeable surfaces) to manage stormwater, reduce urban heat, enhance biodiversity, and support carbon sequestration. Embedding these measures in urban planning strengthens ecosystem services, resilience, and livability.",Projects & Physical Actions,Nature-Based Solutions,medium,<5 years,
icare_0181,Restore in Vulnerable Areas,adaptation,"A comprehensive project addressing the socio-environmental vulnerability of an informal settlement. It includes relocating residents from flood-prone areas, restoring the environment, and providing infrastructure and social services.",Projects & Physical Actions,Nature-Based Solutions,medium,"5-10 years",
icare_0182,Develop an Urban Afforestation Plan,adaptation,"This action focuses on expanding green areas in the city through urban afforestation. This includes planting trees in sidewalks, squares, public buildings, and schools, as well as creating ecological parks to revitalize watercourses and/or restore forests.",Projects & Physical Actions,Nature-Based Solutions,medium,"5-10 years",
icare_0183,Implement Multi-hazard Early Warning Systems (MH-EWS),adaptation,"Early Warning systems involve the timely detection and communication of potential climate-related hazards, enabling proactive responses to mitigate risks and enhancing community preparedness. This includes intense rains and landslides, using a network of telemetry stations to monitor rainfall and other weather conditions, with clear trigger thresholds to issue public alerts (sirens/alarms, SMS/cell broadcast, radio/PA) in case of potential flooding or landslides.",Projects & Physical Actions,Emergency Infrastructure,medium,"5-10 years",
icare_0184,Upgrade Slope stabilization and drainage,adaptation,"This action involves stabilizing slopes and maintaining or restoring drainage systems in hillside areas. This helps to prevent landslides and erosion, reducing the risk of disasters.",Projects & Physical Actions,Infrastructure Development,medium,"5-10 years",
icare_0185,Improve Creation of An Epidemiological Intelligence Center,adaptation,"This action focuses on establishing an epidemiological intelligence center to monitor public health indicators and provide accessible information to the population. This helps in making informed decisions and protecting public health, particularly in relation to climate-sensitive diseases.","Data, Tools & Planning Projects",Data Collection / Baseline Studies,medium,"5-10 years",
icare_0186,Implement integrated coastal zone management,adaptation,This action describes the implementation of an integrated coastal zone management plan to promote sustainable development and address the impacts of climate change in coastal areas. It includes measures to mitigate the impacts of sea-level rise and coastal erosion.,"Policies, Plans & Programs",Strategic Plans,medium,"5-10 years",coastal_marine
icare_0188,"Create an Environmental Health Surveillance Program related to Populations Exposed to Air Pollution, Noise Pollution, Water Pollution, and Soil Pollution.",adaptation,"Develop actions aimed at promoting the health of the population exposed to environmental factors related to atmospheric, noise, and sanitation pollutants. Identify and evaluate the acute and chronic risks and effects of exposure to fixed and mobile sources of air, noise, water, and soil pollution, and act in the surveillance of diseases derived from these pollutants through physical units and work groups, especially among the most vulnerable people.","Data, Tools & Planning Projects",Data Collection / Baseline Studies,medium,"5-10 years",
ipcc_0001,Promote compact urban form and transit-oriented development,mitigation,"Encourages compact and mixed-use urban development to reduce travel distances, car dependency, and related GHG emissions. Measures include transit-oriented development (TOD), zoning reforms, densification around transport corridors, and integration of land use and mobility planning. Particularly suited for larger cities with the capacity to update master plans and invest in transit infrastructure.","Policies, Plans & Programs",Strategic Plans,high,>10 years,
ipcc_0023,Design products with lightweight materials,mitigation,"This action involves improving material efficiency by designing lighter products, optimizing material usage to maintain functionality, and incorporating circular economy principles such as reusability, repairability, and recyclability. It spans the entire product lifecycle, from design to end-of-life management.","Policies, Plans & Programs",Regulation & Standards,high,"5-10 years",
ipcc_0024,Improve material utilization efficiency in production,mitigation,"This action focuses on enhancing material efficiency by adopting near-net shape casting and similar innovative manufacturing techniques. These methods reduce material wastage during production, improve yield from raw materials, and enhance energy efficiency by minimizing reprocessing. Strategies include optimizing product design, lightweighting, and improving recycling and reuse processes.",Projects & Physical Actions,Energy & Building Retrofits,high,"5-10 years",
ipcc_0025,"Design for Recovery, Reuse, or Repurposing",mitigation,"This action involves designing products to enable circular principles such as extended product life, reusability, repairability, and ease of recycling. It emphasizes lightweighting, material optimization, and improved recovery of materials at the end of their lifecycle through reuse, remanufacturing, or recycling.","Policies, Plans & Programs",Regulation & Standards,high,"5-10 years",
ipcc_0026,Adopt alternative feedstocks in industrial production,mitigation,"Utilizing alternative feedstocks, such as blast furnace slag, fly ash, and pozzolans, to reduce the clinker-to-cement ratio in cement production. These alternatives lower emissions associated with calcination and energy-intensive processes. Improved material efficiency through high-strength concretes and innovative placement methods further reduces material usage.",Projects & Physical Actions,Energy & Building Retrofits,high,"5-10 years",
ipcc_0028,"Behavioral Changes for Reduced Waste (e.g., Food)",mitigation,"Encouraging behavioral changes to reduce waste in industrial processes and consumer habits, particularly in food production and consumption. This includes reducing food waste through better planning, optimizing portion sizes, and improving recycling and reuse practices in production and post-consumption stages.","Policies, Plans & Programs",Public Programs / Incentives,high,"5-10 years",
ipcc_0031,Enhanced product service levels per product (e.g. product sharing),mitigation,"Promotes more intensive use of durable products by encouraging product sharing, which reduces the demand for new products and the associated GHG emissions from their manufacturing and supply chain.","Policies, Plans & Programs",Public Programs / Incentives,high,"5-10 years",
ipcc_0033,Improve product maintenance to extend lifespan,mitigation,Extending the lifespan of buildings and infrastructure by maintaining their structural integrity through improved product stock maintenance. This involves ensuring concrete structures remain functional for over 200 years.,"Policies, Plans & Programs",Regulation & Standards,high,"5-10 years",
ipcc_0034,Promote consumer behavior focused on sufficiency and reduced consumption,mitigation,"Promotes behavioral and consumption changes to reduce overall industrial emissions, emphasizing reduced demand for products, reuse and recycling, and more efficient use of resources.","Policies, Plans & Programs",Public Programs / Incentives,high,"5-10 years",
ipcc_0037,Adopt net-zero-emissions materials and supply chains,mitigation,"Transition to net-zero embodied carbon in construction by substituting emissions-intensive materials (e.g., steel, concrete) with engineered timber systems (including mass timber for mid-rise buildings) and by integrating circular practices (reuse, recycling, design for disassembly). Prioritize certified sustainable forestry (e.g., FSC/PEFC), cascading use, and no-deforestation safeguards, ensuring timber use does not conflict with energy feedstocks. Use lifecycle assessment to guide material choices and supply-chain improvements.","Policies, Plans & Programs",Regulation & Standards,high,>10 years,
ipcc_0038,Stimulate solar energy production in industrial facilities,mitigation,Encourage the installation of solar energy systems in factories to reduce dependence on fossil fuels and minimize associated emissions.,Projects & Physical Actions,Energy & Building Retrofits,high,"5-10 years",
ipcc_0039,Promote the substitution of traditional materials with sustainable alternatives,mitigation,"Stimulate the replacement of conventional materials in consumer goods with alternatives from Brazil's bioeconomy, such as sugarcane-based bioplastics, high-quality recycled polymers, bio-textiles made from biomass fibers or agricultural waste such as açaí seeds and coconut husks.","Policies, Plans & Programs",Public Programs / Incentives,high,>10 years,
ipcc_0040,Promote industry-government collaborations on emissions reduction,mitigation,Foster collaborations between industry and government to create policies and incentives for reducing industrial emissions and supporting sustainability goals.,"Policies, Plans & Programs",Institutional Frameworks,medium,"5-10 years",
ipcc_0041,Support research into carbon-neutral manufacturing technologies,mitigation,Invest in research and development of carbon-neutral technologies and encourage their adoption in industrial production.,"Policies, Plans & Programs",Public Programs / Incentives,medium,"5-10 years",
ipcc_0042,Set carbon emissions reduction targets for industrial sectors,mitigation,Establish clear and achievable carbon emissions reduction goals for industries and require periodic reporting to ensure progress.,"Policies, Plans & Programs",Regulation & Standards,high,"5-10 years",
ipcc_0043,Encourage the Use of Zero-Emission Fuels in Industrial Processes,mitigation,"Promote the transition to zero-emission energy sources and feedstocks in industrial processes, such as green hydrogen, biogas from sustainable sources, and synthetic e-fuels or chemicals produced with renewable electricity. These alternatives significantly reduce or eliminate process emissions compared to fossil-based fuels.
Cities can accelerate this shift by implementing pilot and demonstration projects, establishing green procurement standards, streamlining permitting processes, and creating targeted incentives, all aligned with national and sectoral decarbonization roadmaps.","Policies, Plans & Programs",Public Programs / Incentives,high,"5-10 years",
ipcc_0045,Transition to renewable energy for industrial operations,mitigation,"Encourage the shift to renewable energy sources such as wind, solar, and hydroelectric power in industrial operations to reduce fossil fuel use.","Policies, Plans & Programs",Public Programs / Incentives,medium,<5 years,
ipcc_0049,Develop and implement circular economy policies,mitigation,"Circular Economy (CE) policies aim to close the loop for materials and energy flows by reducing, reusing, and recycling resources. These policies promote durable goods, reuse and remanufacturing, industrial symbiosis, and urban symbiosis to minimize waste and reduce GHG emissions. CE policies operate at micro, meso, and macro levels to integrate strategies like eco-design, sustainable supply chains, and urban energy symbiosis.","Policies, Plans & Programs",Regulation & Standards,medium,"5-10 years",
ipcc_0050,Create tax incentives for companies adopting clean technologies,mitigation,"Implement tax incentives and subsidies for companies that invest in clean technologies, leading to substantial emission reductions.","Policies, Plans & Programs",Public Programs / Incentives,low,<5 years,
ipcc_0052,Reduce Deforestation and Degradation,mitigation,Reduce deforestation and forest degradation to conserve carbon sequestered in forest vegetation and soil by avoiding tree cover loss and disturbance. This involves improving forest governance and supporting community forest management. Enhance monitoring and enforcement to prevent illegal deforestation and promote sustainable land use.,Projects & Physical Actions,Nature-Based Solutions,medium,"5-10 years",tropical_rainforest
ipcc_0053,"Implement afforestation, reforestation, and forest ecosystem restoration",mitigation,"Advance tree-planting and forest recovery initiatives that strengthen biodiversity, ecosystem services, and carbon sequestration. Afforestation establishes new forests on historically non-forested land, reforestation restores deforested areas, and ecosystem restoration prioritizes native species and ecological integrity. Municipal governments should avoid monocultures, ensure projects deliver long-term benefits, and engage local communities so that restoration efforts provide social, cultural, and economic value alongside environmental gains.",Projects & Physical Actions,Nature-Based Solutions,high,"5-10 years",
ipcc_0054,Adopt sustainable forest management practices,mitigation,"Sustainable forest management of already managed forests will increase carbon stocks, improve wood quality, mitigate disturbances, and provide co-benefits like biodiversity conservation, water regulation, and soil protection. Practises include longer rotations, reduced harvesting, mixed stands, and climate-smart forestry, and working with Indigenous Peoples is essential to safeguard their work and practices. Cities can apply these principles if they are responsible for forest management, or partner with those responsible to encourage and support best practice.",Projects & Physical Actions,Nature-Based Solutions,high,"5-10 years",
ipcc_0055,"Implement fire management in forests, grasslands, and savannas",mitigation,"Implement fire management practices, including prescribed burning and natural resource management, to reduce uncontrolled wildfires in forests and savannas. Focuses on safeguarding life, property, and resources while mitigating GHG emissions and maintaining carbon stocks. Cities can apply these principles if they are responsible for forest management, or partner with those responsible to encourage and support best practice. Work with Indigenous Peoples to safeguard or support their own burning practices and fire management approaches.",Projects & Physical Actions,Nature-Based Solutions,medium,"5-10 years",
ipcc_0056,Reduce and prevent degradation and conversion of Grasslands and Savannas,mitigation,"Prevent the conversion of grasslands and savannas to croplands to conserve soil carbon and biodiversity, and implement sustainable soil management practices in croplands and grasslands to enhance soil organic carbon. Cities can promote sustainable grazing, reduced tillage, fire management, biochar application, improved grass varieties and vegetation management practices, while discouraging land-use change that accelerates degradation. Partnerships with local communities and alignment with regional conservation initiatives strengthen the protection of these ecosystems.These activities aim to increase soil organic matter, mitigate GHG emissions, and provide co-benefits for biodiversity, water provision, and food security.",Projects & Physical Actions,Nature-Based Solutions,medium,"5-10 years",grassland_savanna
ipcc_0057,Restore degraded peatlands and prevent further conversion or degradation.,mitigation,"Protect intact peatlands from clearing, drainage, and conversion that release large carbon emissions, and rewet and revegetate degraded peatlands to prevent further degradation. Municipal governments can enhance governance and monitoring, restrict agricultural expansion, and collaborate with regional and national programs for wetland conservation. Safeguarding these ecosystems preserves carbon storage, reduces fire risks, and protects biodiversity and ecosystem services. Peatland restoration maintains water regulation, flood prevention, and can foster sustainable livelihoods through paludiculture.",Projects & Physical Actions,Nature-Based Solutions,high,"5-10 years",wetlands
ipcc_0060,Protect and Restore Coastal Wetlands,mitigation,"Restore degraded or damaged coastal ecosystems, including mangroves, salt marshes, and seagrass beds. Restoration includes passive (removal of degradation drivers) and active (environmental manipulation) approaches to reinstate ecosystem functions and carbon sequestration potential. This supports biodiversity conservation, fisheries production, soil stabilization, water quality regulation, flood prevention, and resilience against cyclones. Cities can either take on restoration activities themselves, require restoration as part of Urban Planning and land use regulations, or partner with government, ecological organisations and other partners to carry out restoration projects. Economic incentives or regulations on activities that degrade coastal wetlands may also be effective.",Projects & Physical Actions,Nature-Based Solutions,high,>10 years,
ipcc_0062,Create partnerships to implement biochar plants.,mitigation,"Biochar is produced by heating organic matter (e.g., forestry residues, straw, manure) in oxygen-limited environments. It has significant mitigation potential through carbon dioxide removal (CDR), reduced greenhouse gas emissions, and soil application benefits like improved fertility and reduced N2O emissions. Cities can consider trialling and adopting these technologies, in collaboration with local rural producers, utility companies and other industrial stakeholders.",Projects & Physical Actions,Nature-Based Solutions,high,"5-10 years",
ipcc_0064,Reduce methane emissions from enteric fermentation in livestock,mitigation,"This action targets methane (CH4) emissions from enteric fermentation in livestock through direct interventions like feed additives, inhibitors, or vaccines, and indirect measures like improving production efficiency through better breeding and husbandry practices. It also includes early-life manipulation of the ruminal biome. Adopt or develop local standards for feed additives, vaccines, and inhibitors, and support rural producers to overcome barriers to costs, infrastructure and skills on this topic.","Policies, Plans & Programs",Regulation & Standards,medium,"5-10 years",
ipcc_0067,Improve manure management and crop nutrient practices,mitigation,"Promote collective and cost-effective approaches to reduce methane (CH₄) and nitrous oxide (N₂O) emissions from manure storage and use, and implementation of improved crop nutrient management practices to reduce N2O emissions from cropland soils. Municipal governments can support the development of cooperative biodigesters, composting initiatives, and improved storage facilities, while encouraging better fertilizer application, crop rotation and grazing practices. These measures enhance nutrient recovery for crop production, reduce fertilizer costs, and generate co-benefits such as renewable energy through biogas. By facilitating financing models, partnerships, and technical assistance, cities can help farmers adopt sustainable manure and nutrient management practices at scale. ","Policies, Plans & Programs",Public Programs / Incentives,high,"5-10 years",
ipcc_0068,Pilot Bioenergy with Carbon Capture in Partnership with Utilities/Industry.,mitigation,"Bioenergy involves producing energy from organic sources like biomass, organic waste, and harvest residues, displacing fossil fuels in heat, electricity, and fuel production. When combined with carbon capture and storage (BECCS), it stores biogenic carbon in geological or terrestrial reservoirs, achieving negative emissions. BECCS can also integrate with agriculture and forestry for co-benefits like land restoration and biogas production. Cities can consider piloting and trialling these technologies, in collaboration with local rural producers, utility companies and other industrial stakeholders.","Data, Tools & Planning Projects",Tech Pilots & Deployments,high,>10 years,
ipcc_0069,Promote sustainable and healthy diets,mitigation,"Support the transition to dietary patterns that improve health and reduce environmental impacts. This usually focusses on reducing animal-based food consumption (especially ruminants) and promoting plant-based options, making the action implementable and socially equitable. Cities can act through public procurement policies in schools, hospitals, events, and other institutions, as well as awareness campaigns and promoting national food guidelines.","Policies, Plans & Programs",Public Programs / Incentives,medium,"5-10 years",
ipcc_0070,Reduce food loss and waste,mitigation,"Food loss and waste can be reduced through measures across the food supply chain, including improved harvesting and post-harvesting technologies and behaviours. To achieve these changes, cities can consider implementing food waste policies like mandatory reporting, reduction targets, consumer awareness and education campaigns, infrastructure for food storage and transportation, policy frameworks for waste reduction, financial incentives and taxation, and positive marketing for imperfect food products.","Policies, Plans & Programs",Public Programs / Incentives,medium,"5-10 years",
