"action_id","action_name","action_type","description","action_category","action_subcategory","investment_cost","implementation_timeline","biome"
icare_0026,Implement time-of-use electricity tariffs to enhance demand-side flexibility and efficiency,mitigation,"The city will work with energy regulators and utilities to introduce time-of-use (TOU) electricity tariffs that incentivize consumers to shift energy use toward off-peak hours. By encouraging demand-side flexibility, this measure helps to balance grid demand, ensure grid stability, and lower energy costs for consumers, particularly when combined with energy-efficient appliances and smart metering technologies. Municipal roles may include advocating for regulatory approval, piloting TOU programs in public facilities, and raising awareness among residential, commercial, and industrial users. This action supports the city’s broader energy efficiency and resilience objectives, helping to integrate renewable energy more effectively and reduce peak load pressures.","Policies, Plans & Programs",Regulation & Standards,low,<5 years,
icare_0027,Create financing programs for local renewable energy projects,mitigation,"Establish funding mechanisms, such as grants and low-interest loans, to support the development of small-scale renewable energy initiatives in communities. These programs can also support community renewable energy farms and cooperatives, enabling shared access to clean power and strengthening local ownership models.","Policies, Plans & Programs",Public Programs / Incentives,medium,"5-10 years",
icare_0028,"Promote passive cooling through natural shading and ventilation in residential, commercial, and public buildings",mitigation,"The city will require or encourage passive cooling design features—including shaded facades, green roofs, natural ventilation, reflective surfaces, and cross-ventilation layouts—to reduce dependence on mechanical air conditioning in residential, commercial, and public buildings. These measures improve indoor comfort, lower energy demand, and enhance urban resilience to heat stress. Implementation can include updating building codes, incentivizing retrofits, and providing design guidance for new developments and renovations. This action complements other green building initiatives and supports long-term climate adaptation through energy efficiency and thermal comfort.","Policies, Plans & Programs",Regulation & Standards,low,<5 years,
icare_0031,Capture & Use Biogas at Wastewater Treatment Plants',mitigation,"Install biogas systems in wastewater treatment facilities to produce renewable energy from organic sludge, reducing emissions and operational costs. Technologies may include sludge digestion, CHP for plant loads, and upgrading to biomethane for vehicles. This action can be financed by development banks and can be scaled by regionalization.",Projects & Physical Actions,Energy & Building Retrofits,high,"5-10 years",
icare_0033,Install biodigesters in rural properties,mitigation,"Equip rural farms and properties with biodigesters to convert organic waste into biogas and nutrient-rich fertilizers, providing a sustainable energy source.",Projects & Physical Actions,Energy & Building Retrofits,medium,<5 years,
icare_0034,Improve Fuel Supply Systems for Industrial Heating,mitigation,"Enhancing fuel delivery systems in the steel production process by implementing technologies such as pulverized coal injection, improving furnace designs and process controls, and optimizing fuel combustion for heating. Includes energy efficiency measures to reduce emissions from coal and coke used in conventional iron-making, and the potential adoption of alternative reductants like biomass and waste plastics.",Projects & Physical Actions,Energy & Building Retrofits,low,<5 years,
icare_0035,Enhance industrial energy efficiency processes,mitigation,Implement advanced technologies and process optimizations in industrial facilities to minimize energy consumption and improve productivity.,Projects & Physical Actions,Energy & Building Retrofits,medium,"5-10 years",
icare_0040,Deploy energy-efficient and solar-powered street lighting across all neighborhoods,mitigation,"The city will install LED-based (or other low emission technologies), solar-powered streetlights in all neighborhoods, including rural and peri-urban areas, to enhance safety, accessibility, and social inclusion while reducing energy costs and environmental impacts. Where feasible, the action prioritizes solar power generation, especially in areas with limited grid coverage or high carbon intensity. In locations where the electricity grid is already clean, the focus will be on maximizing lighting efficiency through LED retrofits and smart controls. Municipal roles include procuring equipment, establishing public–private financing mechanisms, and contracting long-term maintenance services to ensure system reliability. This action delivers strong co-benefits for communities of all sizes but requires careful planning to address maintenance and operational challenges.",Projects & Physical Actions,Infrastructure Development,medium,"5-10 years",
icare_0045,"Promote organic, regenerative and agroecological agriculture in rural areas",mitigation,"Promote organic, regenerative and agroecological agricultural principles in the rural areas of the city. This can include reducing reliance on chemical pesticides, improving soil health and promoting carbon sequestration in the soil. Actions could include providing technical training and educational programmes for rural producers, using economic instruments to incentivize agroecological conversion, and creating resources or networks for skill sharing. Work cooperatively with rural producers, including engaging with Indigenous practises and skillsets.","Policies, Plans & Programs",Public Programs / Incentives,low,<5 years,
icare_0049,Develop regional hubs for renewable energy production,mitigation,"Establish strategic centers for large-scale renewable energy generation, supporting local economies and providing reliable, clean energy to surrounding areas.",Projects & Physical Actions,Infrastructure Development,high,>10 years,
icare_0050,Accelerate the adoption of Agroforestry',mitigation,"Promote agroforestry systems by integrating trees into food cultivation and pasture, increasing biodiversity and carbon sequestration. Agroforestry integrates trees and shrubs with crops and/or livestock to sequester carbon, enhance soil health, reduce soil erosion, improve water quality, and diversify livelihoods. It also offers co-benefits like mitigating regional climates and increasing land productivity while addressing risks like biodiversity and hydrology impacts. Agroforestry systems can include silvopastoral systems, alley cropping, riparian buffer planting. Create financial and technical incentives for integrating agroforestry practices into livestock systems.",Projects & Physical Actions,Nature-Based Solutions,medium,"5-10 years",
icare_0053,Support cooperatives of voluntary waste collectors to aggregate into small enterprises and expand into organics management,mitigation,"Measures to aggregate voluntary waste collectors into small enterprises or associtations, improve working conditions and income in the processes of sorting recyclable and organic waste to contribute for GHG emissions reduction and the increase climate risk resilience. It includes mapping individual and groups of voluntary waste collectors, provide training for collectors in waste management and treatement technologies, economics, business management, and conceptual planning for the operation and administration of the Sorting Unit.","Policies, Plans & Programs",Public Programs / Incentives,medium,<5 years,
icare_0064,Develop an organic waste management strategy ,mitigation,"Development of an organic waste management strategy with near, mid and long term interventions, integrating aquisition and implementation of organic waste treatment technologies and resources to build the adequate infrastructure to treat the collected waste, such as composting, biodigestion and other technologies, in order to reduce the amount sent to landfills and to achieve maximum organics waste diversion","Policies, Plans & Programs",Strategic Plans,medium,"5-10 years",
icare_0069,Complete ecological and agroclimatic mapping,mitigation,"Use zoning and mapping tools to identify areas best suited for sustainable agriculture and those that require environmental preservation. Incorporate findings into planning or zoning regulations, Economic Plans, Climate Action Plans and associated strategic work or policy design. Include mappings of local Indigenous and smallholder-linked land, public spaces, socio-economic data and other priorities. This will help inform plans to accelerate agroecological production locally and preserve ecologically important areas, and can be a useful tool for engaging stakeholders.","Data, Tools & Planning Projects",Data Collection / Baseline Studies,low,<5 years,
icare_0071,Increase efficiency of industrial furnaces and kilns,mitigation,"Enhancing the design and operation of furnaces and kilns to improve energy efficiency and reduce emissions. Includes technologies such as improved heat and energy recovery from process gases, advanced process controls, and better furnace designs to minimize temperature cycles and optimize fuel usage.",Projects & Physical Actions,Energy & Building Retrofits,medium,"5-10 years",
icare_0072,Improve Heat Recovery and Reuse through Heat Exchanger Networks or Heat Pumps,mitigation,"This action involves improving heat-use energy efficiency by utilizing heat exchanger networks and high-temperature heat pumps to recover and reuse waste heat in industrial processes. Techniques include reducing heat needs via thermal insulation, reusing waste heat at various temperature grades, and recycling waste heat for power generation through technologies such as mechanical vapor recompression and thermoelectric conversion.",Projects & Physical Actions,Energy & Building Retrofits,low,<5 years,
icare_0074,Adopt industrial energy efficiency technologies,mitigation,"Implementation of energy-efficient technologies in mining processes, particularly in comminution, by upgrading ore concentration methods, using efficient grinding and crushing technologies, and optimizing particle size feed. Other opportunities include improving separation, drying, and materials handling processes.",Projects & Physical Actions,Energy & Building Retrofits,medium,"5-10 years",
icare_0076,Electrify Industrial Processes (with Renewable Power),mitigation,"Transitioning steel production processes to electrified methods such as molten oxide electrolysis, advanced direct reduction, and other methods powered by low-carbon electricity to reduce emissions and improve energy efficiency.",Projects & Physical Actions,Energy & Building Retrofits,medium,>10 years,
icare_0078,Decarbonize industrial feedstocks,mitigation,"Decarbonising feedstocks for industrial processes through Carbon Capture and Storage (CCS), Carbon Capture and Utilisation (CCU), and integration with low-carbon energy sources. This includes capturing carbon from various industrial emissions and reusing or storing it to reduce greenhouse gas emissions. Applications include creating synthetic fuels, chemicals, and materials while using renewable energy or biogenic carbon sources.",Projects & Physical Actions,Energy & Building Retrofits,medium,"5-10 years",
icare_0079,Implement carbon capture and utilization (CCU),mitigation,"Capturing CO₂ from industrial processes or combustion gases and reusing it for producing fuels, chemicals, and building materials, reducing emissions from the initial source and substituting new fossil/biogenic feedstocks. Prioritize CCU for residual emissions and for end-uses with robust MRV and, where possible, durable carbon retention; do not displace higher-priority efficiency and material circularity measures.",Projects & Physical Actions,Infrastructure Development,low,<5 years,
icare_0082,Implement carbon capture and storage (CCS),mitigation,"Carbon Capture and Storage (CCS) involves capturing CO₂ from industrial processes, energy generation, or the atmosphere and storing it in geological formations for millennia. CCS can enable near-zero or negative emissions when combined with sustainably sourced biofuels or direct air capture. Apply CCS primarily to residual/process emissions (e.g., calcination) after efficiency, circularity, and electrification have been pursued where feasible.",Projects & Physical Actions,Infrastructure Development,high,>10 years,
icare_0099,Increase local participation in Agroecological Certification Programmes,mitigation,"Agroecological product certifications confirm products meet sustainability criteria and have low environmental impact. Certifications may help rural producers to understand sustainable practices, improve their use of sustainable practices, and increase demand for their products. Actions include creating a dedicated local programme, starting a partnership with an existing certification programme, or raising awareness of certification options and routes to compliance among local producers.","Policies, Plans & Programs",Public Programs / Incentives,low,<5 years,
icare_0101,Accelerate the adoption of Zero Emission Agricultural Machinery,mitigation,"Support the transition to zero-emission agricultural machinery, such as tractors and equipment powered by renewable electricity or solar energy. These technologies eliminate greenhouse gas emissions, reduce harmful air pollution and noise, and offer opportunities to modernize and improve agricultural tools and practices. Cities and regions can take multiple actions to accelerate this transition, including:
- Replacing existing municipal machinery with zero-emission alternatives.
- Establishing equipment leasing or sharing schemes to increase accessibility.
- Launching local awareness campaigns through training, education, and communication channels.
- Creating financial incentive or loan programs to encourage adoption.
- Partnering with manufacturers and organizing fairs or demonstrations to showcase zero-emission technologies and other sustainable agricultural solutions to local producers.","Policies, Plans & Programs",Public Programs / Incentives,medium,"5-10 years",
icare_0104,Adopt hybrid renewable energy systems (solar-wind),mitigation,"Combine solar and wind energy technologies to create reliable, diversified renewable energy systems suitable for various environmental conditions.",Projects & Physical Actions,Infrastructure Development,high,>10 years,
icare_0105,Reduce technical losses in energy distribution networks,mitigation,"Upgrade and maintain electrical infrastructure to minimize energy lost during transmission and distribution, improving overall grid efficiency.",Projects & Physical Actions,Infrastructure Development,medium,"5-10 years",
icare_0110,"Regulate Construction and Demolition Waste Management to improve deconstruction, segregation at source, reutilization and recycling",mitigation,"Establish comprehensive guidelines for the sustainable management of construction and demolition waste (CDW) to promote efficiency, circularity, and environmental responsibility across the construction sector. The action aims to reduce waste generation at the source, encourage selective deconstruction instead of conventional demolition, and foster material segregation, reuse, and recycling.

These guidelines should define technical standards, responsibilities, and incentives for all stakeholders involved — including contractors, developers, and waste operators — to ensure that valuable materials such as concrete, metals, wood, and aggregates are recovered and reintegrated into new construction cycles. The framework should also establish procedures for safe handling, transportation, and disposal of non-recyclable materials, ensuring compliance with environmental regulations and minimizing landfill use.","Policies, Plans & Programs",Regulation & Standards,medium,<5 years,
icare_0111,Strengthen Extended Producer Responsibility (EPR) Systems,mitigation,"Enhance processes for returning products to the production cycle, encouraging collection, reuse, and recycling.","Policies, Plans & Programs",Regulation & Standards,medium,"5-10 years",
icare_0117,Improve public transport systems to promote modal shift,mitigation,"Implements measures to enhance the coverage, frequency, capacity, speed, reliability, accessibility, resilience, safety, affordability, comfort, and convenience of public transport systems (e.g., buses, BRT, informal transport, intra-city rail). Specific actions include expanding routes, improving service frequency and reliability, integrating ticketing systems, and ensuring universal accessibility. These improvements encourage passengers to shift from private motorized transport to public transport, reducing emissions and supporting more sustainable mobility.",Projects & Physical Actions,Mobility & Transport Projects,medium,"5-10 years",
icare_0120,"Implement energy efficiency criteria and indicators in the procurement of goods, services, or works by the municipal public administration.",mitigation,"The architectural projects for all renovations and constructions contracted must be designed to minimize the use of artificial lighting and internal cooling, allowing for the use of natural light and cross ventilation. It sould include all energy end-uses in municipal buildings, promote the use of sustainable materials, and adoption of passive design principles.","Policies, Plans & Programs",Regulation & Standards,low,<5 years,
icare_0121,"Incentive to create bike-sharing programs in urban areas, with a focus on electric bikes.",mitigation,"This action encourages the establishment of bike-sharing systems in cities, specifically promoting the use of electric bicycles. These systems allow residents to rent electric bikes for short trips, reducing the dependence on cars for urban transportation. By integrating electric bikes, cities can further reduce greenhouse gas emissions, alleviate traffic congestion, and promote a healthier and more sustainable mode of transportation for both urban and rural areas. This initiative also supports mobility equality, as it makes bikes more accessible to a wider range of people.","Policies, Plans & Programs",Public Programs / Incentives,medium,<5 years,
icare_0122,Establish eco-parks.,mitigation,"An eco-park is a facility for the mechanical and biological treatment of urban solid waste, integrating different technologies for the segregation and treatment of various fractions within the waste. This treatment aims to maximize the recovery of dry and organic waste and reduce the volume of waste to be sent for final disposal in landfills, using technologies such as energy generation, composting, recycling recovery, proper disposal of residual waste, and other existing treatment methods available in the market. By integrating these processes , eco-parks operate as multi-technology hubs for waste management, fostering synergies between waste reduction, energy recovery, and environmental protection for the cities. They also contribute to green job creation, climate change mitigation, and urban sustainability.",Projects & Physical Actions,Infrastructure Development,medium,<5 years,
icare_0127,Improve Accelerate Environmental Regularization of Rural Properties,mitigation,Implement programs to register properties in the Rural Environmental Registry (CAR) and adhere to environmental restoration commitments.,"Policies, Plans & Programs",Public Programs / Incentives,medium,"5-10 years",
icare_0128,Establish Municipal Programs for Payment for Environmental Services and other ecological financial incentives,mitigation,"Financial incentives such as loans, taxes, grants and rebates can be effective ways to promote ecological conservation and more sustainable practices. Municipalities can initiate schemes or help implement regional or national programmes. Payment for Environmental Services involves paying landowners for maintaining or improving environmental conditions on their properties.","Policies, Plans & Programs",Public Programs / Incentives,medium,"5-10 years",
icare_0131,Prioritize Procurement of Locally Produced Agroecological Products in Public Purchases,mitigation,"Focus on buying sustainable, locally produced food for public institutions. Additional actions could include identifying reliable local suppliers, partnering with producers and allocating funding to wider sustainable procurement programs and establishing monitoring systems to ensure compliance with sustainability goals","Policies, Plans & Programs",Regulation & Standards,low,<5 years,
icare_0132,Encourage Local Agroecological Production and Short Supply Chains,mitigation,"Support local, sustainable agricultural practices and reduce emissions associated with food transport. Actions could include incentives for local food distribution networks, partnerships with producers and investment in infrastructure to support local markets and policies to prioritize low-emission transportation methods. These should be underpinned by other programmes to encourage local sustainable agriculture methods.","Policies, Plans & Programs",Public Programs / Incentives,low,<5 years,
icare_0137,Replace Inefficient Lighting with LED Technology in Public Spaces,mitigation,"This action focuses on replacing outdated and inefficient lighting systems in public spaces with energy-efficient LED technology. The objective is to enhance energy efficiency, reduce operational costs, and lower carbon emissions, contributing to a more sustainable and environmentally-friendly municipal infrastructure.",Projects & Physical Actions,Energy & Building Retrofits,medium,<5 years,
icare_0139,Implement congestion pricing and restrictions on high-polluting vehicles,mitigation,"The city introduces congestion pricing and related restrictions (such as tolls, charges, or bans) on high-polluting vehicles that cover significant parts of the city. To ensure equity and social acceptance, design measures may include exemptions or discounts for low-income drivers, reinvestment of revenues into public transport and active mobility, and strong communication campaigns. While congestion pricing can deliver major emission reductions, it requires substantial governance capacity and is best suited for larger metropolitan areas.","Policies, Plans & Programs",Regulation & Standards,low,<5 years,
icare_0144,Establish a financial support program for extreme weather events,adaptation,"Creation of a program to mitigate the effects of climate tragedies, including financial assistance to affected families, efforts to increase access to affordable hazard insurance, and efforts to secure additional resources for recovery and reconstruction, including partnerships with state and federal government bodies. Recovery and reconstruction measures should include adaptive measures with the emphasis on build back better to withstand future hazards and helping residents retrofit buildings.","Policies, Plans & Programs",Public Programs / Incentives,medium,<5 years,
icare_0145,Strengthen the healthcare system to respond effectively to extreme events,adaptation,"Improve the infrastructure of healthcare units to assist people who require medical care due to impacts associated with climate risks (climate victims), such as those affected by heat waves or floods, especially in more vulnerable areas. Develop action plans to prepare the healthcare network for extreme climate-related situations.",Projects & Physical Actions,Emergency Infrastructure,high,>10 years,
icare_0154,Clean and unclog drainage channels and install eco-barriers,adaptation,Cleaning and unclogging channels in the city to reduce the risk of flooding caused by extreme rainfall events. Installation of eco-barriers to assist in cleaning efforts and raise awareness about solid waste.,Projects & Physical Actions,Infrastructure Development,medium,<5 years,
icare_0156,Improve Implementation of urban gardens,adaptation,Identify and assess the feasibility of suitable areas for the installation of urban gardens and ensure that the sites chosen meet the expectations of the community.,Projects & Physical Actions,Nature-Based Solutions,low,<5 years,
icare_0160,Establish mechanisms for intersectoral coordination and public participation in climate policy,adaptation,"Establish more mechanisms that enable better intersectoral coordination and public participation in climate policy, including the creation of working groups with neighboring municipalities to discuss a common climate agenda.","Policies, Plans & Programs",Institutional Frameworks,low,<5 years,
icare_0162,Strengthen programs for control and conservation of protected areas,adaptation,"This action focuses on implementing a series of integrated strategies to enhance environmental conservation and maximize its benefits, such as expanding protected areas, developing management plans for conservation units, and training ecotourism guides to strengthen sustainable tourism.",Projects & Physical Actions,Nature-Based Solutions,medium,"5-10 years",
icare_0163,Establish a first‑response firefighting brigade,adaptation,Creation of a First Response Brigade in rural communities to provide them with training and equipment for fire prevention and firefighting.,Projects & Physical Actions,Emergency Infrastructure,low,<5 years,
icare_0164,Improve Hydrological Monitoring System with Telemetry Stations,adaptation,"Implementation of a hydrological monitoring system with telemetry stations to monitor rainfall, water levels, and meteorological variables in real-time.","Data, Tools & Planning Projects",Data Collection / Baseline Studies,low,<5 years,
